place_id,place_name,comm_score,cover_image_url,location,tag_list,coordinate_type,latitude,longitude,address,description
147564162,Bugok Sports Park,0.0,https://ak-d.tripcdn.com/images/fd/tg/g1/M06/FC/24/CghzflW7H_iATdynAAA-FlXAIeA738.jpg,Uiwang-si,,GCJ02,37.314091,126.959241,"6 Bugokgongwon-gil, Uiwang-si, Gyeonggi-do, South Korea",No Description
136960545,Gangleung,5.0,https://ak-d.tripcdn.com/images/fd/tg/g1/M08/FC/24/CghzflW7IACAHgzUAAAvGcMqieg905.jpg,Seoul,['Historical Sites'],GCJ02,37.63975,127.105538,"223-19 Gongneung-dong, Nowon-gu, Seoul, South Korea",No Description
146400342,Baengnyeonsa Temple,0.0,https://ak-d.tripcdn.com/images/fd/tg/g1/M06/FC/24/CghzflW7H_iATdynAAA-FlXAIeA738.jpg,Seoul,,GCJ02,37.586115,126.927335,"321 Hongeun-dong, Seodaemun-gu, Seoul, South Korea",No Description
94878,Dora Observatory,4.2,https://ak-d.tripcdn.com/images/0ww4o120009rklrto1DCC.jpg,Paju-si,"['Planetariums', 'Observation Decks']",GCJ02,37.908965,126.704871,"310 Je3(sam) ttanggul-ro, Jangdan-myeon, Paju-si, Gyeonggi-do, South Korea","The Dora Observatory is located in the north of the military cordon on the western front of Paju City, Gyeonggi-do. It was opened to general tourists in 1987. With the closure of the Songaksan OP (ObservationPost: Observation Post), this observatory was established instead. The living conditions and landscapes such as Songyue Mountain, the bronze statue, and the synergistic farm that you have seen have the following requirements for shooting: it is not allowed to shoot inside the observation deck; other than) before shooting."
147297877,F45 Training Gongdeok,0.0,https://ak-d.tripcdn.com/images/0102u1200086k28vc0A5C.jpg,Seoul,,GCJ02,37.543227,126.947981,"320 Dongmak-ro, Mapo-gu, Seoul, South Korea",No Description
142679062,Lotte Cinema_Siwha,5.0,https://ak-d.tripcdn.com/images/fd/tg/g1/M02/AF/63/CghzfFW7IAaAPaqMAAA-wvU2dn8545.jpg,Siheung-si,['Cinemas'],GCJ02,37.351393,126.741834,"10 Mayu-ro 418beon-gil, Jeongwang-dong, Siheung-si, Gyeonggi-do",No Description
147505028,Theater Sanulrim,0.0,https://ak-d.tripcdn.com/images/0102u1200086k28vc0A5C.jpg,Seoul,,GCJ02,37.555095,126.929939,"157 Wausan-ro, Mapo-gu, Seoul",No Description
146378324,Cube Escape,0.0,https://ak-d.tripcdn.com/images/0102u1200086k28vc0A5C.jpg,Seoul,,GCJ02,37.553279,126.920633,"15 Yanghwa-ro 16-gil, Mapo-gu, Seoul",No Description
