place_id,head_image,user_name,content,user_rating,create_time
58337868,https://ak-d.tripcdn.com/images/0a24c224x8v3zmv5hFACF.jpg,소리지킴이,It&#39;s a public golf course that&#39;s easy to practice golf.,4.0,2023-03-12 18:37:15
58337868,https://ak-d.tripcdn.com/images/1i54d12000dex2bvn9345.jpg,하늘이77,It&#39;s a great place to practice. Various training facilities and spacious training ground are recommended,4.0,2022-05-20 22:27:17
23516544,https://ak-d.tripcdn.com/images/0Z83012000941szjmAE6B.jpg,Mathilda,"I have to say that the environment is really good everywhere in Korea. The sky is very clean and blue, so the pictures taken everywhere are very beautiful. Museums often hold celebrations, and there are some family games with children to participate in.",4.0,2016-06-02 13:11:32
23516544,https://ak-d.tripcdn.com/images/0a22w22348fcoi9kw8C77.jpg,곤듀님,It is recommended because it is a place where you can know the history of Suwon,5.0,2022-10-04 19:53:51
23516544,,,"It&#39;s really too beautiful and beautiful. Next time you come, the scenery is wonderful!",5.0,2017-01-01 20:59:29
23516544,https://ak-d.tripcdn.com/images/fd/headphoto/g5/M08/1F/5A/CggYsFasR9aAIcodAADW0suey28728.jpg,丢丢,The museum is not too big. It&#39;s very quiet and the tickets are cheap. There&#39;s nothing to see.,4.0,2016-05-02 13:16:22
23516544,https://ak-d.tripcdn.com/images/1i54b12000dex2gdeE7AD.jpg,_CF***43,"Small scale, low price, low price, good environment and elegant environment",4.0,2016-02-11 14:57:33
23516544,https://ak-d.tripcdn.com/images/Z80v0h0000008o8w3994D.jpg,junqiao520,"It&#39;s a beautiful museum. Although it&#39;s small, it&#39;s small and exquisite.",3.0,2016-10-27 23:33:29
