place_id,head_image,user_name,content,user_rating,create_time
138983368,https://ak-d.tripcdn.com/images/0a23t2234cc2csxo10F1D.jpg,í•˜ì´í•œìŠ¤,,5.0,2023-08-21 19:49:18
65176566,https://ak-d.tripcdn.com/images/0a2682224slw5law0C6A6.jpg,ë³´ë¼êµ°,"The park in front of the West Gate prison is gradually neat. The landmark of this area. Although the shade is a little insufficient, it is still the best place to rest and tourist attraction.",5.0,2023-06-01 07:23:19
65176566,https://ak-d.tripcdn.com/images/0a2682224slw5law0C6A6.jpg,ë³´ë¼êµ°,"On the park located at the intersection of Independence Gate Station, there are statues of Independence Gate and Dr. Seo Jae-pil of Dr. Yu Guan-soon, under the Seodaemun prison, and local attractions that foreigners can visit.",5.0,2023-05-23 23:31:38
65176566,https://ak-d.tripcdn.com/images/0a24p2215e3xz0f403714.jpg,999í˜„,"If you go up, there is an old prison and the independent gate is magnificent, so it is nice to see. The promenade is also green, so it is a place to walk often",5.0,2023-09-30 23:09:54
95997563,https://ak-d.tripcdn.com/images/0a24o2215dksott0g0FD1.jpg,ëšœëšœë² ë² ë§˜,"Although the traffic may be inconvenient, it&#39;s really good to see cute rabbits in the park that can be reached from Seorae Village ğŸ’",5.0,2023-01-06 05:41:41
95997563,https://ak-d.tripcdn.com/images/0a22h2234a9zp3co04E5E.jpg,ì´ë¯¼14,The air is good and the head is complicated.,5.0,2023-02-17 10:34:42
95997689,https://ak-d.tripcdn.com/images/0a21q22348yfzt8400EB8.jpg,funnyfunky,A place to feel the four seasons,5.0,2022-11-17 15:56:49
