place_id,head_image,user_name,content,user_rating,create_time
30633519,https://ak-d.tripcdn.com/images/Z80e090000003l8beBB17.jpg,萝卜叔叔,"This is a must-choice entertainment project to come to Korea. There is a theater in Myeongdong. I have seen it three or four times. The plot is interesting and interactive, and I can return every time. It is a must-see event for friends in Korea.",5.0,2024-08-29 11:57:12
30633519,https://ak-d.tripcdn.com/images/1i52g12000dex1hwn04E3.jpg,要啥自行车要自行车,"The small theater in Myeongdong, the door sign is not very clear for tourists who don&#39;t understand Korean. The performance is very orderly and worth seeing. The staff at the door are fluent in English and have no barriers to communication.",5.0,2024-06-04 00:55:51
30633519,https://ak-d.tripcdn.com/images/Z80k070000002gyyl35B6.jpg,dragonjan,"Watching again ten years later, very good performance, very interactive, but it feels slightly inferior than ten years ago",5.0,2024-07-27 19:27:16
30633519,https://ak-d.tripcdn.com/images/a20h0l000000d9gh62B6C.jpg,Chinese Friend,,5.0,2024-02-12 20:05:36
30633519,https://ak-d.tripcdn.com/images/0Z82p12000epki9rr039F.jpg,侯静波Helen826,"Features, worth seeing, but not allowed to take pictures",5.0,2024-08-30 09:47:18
30633519,https://ak-d.tripcdn.com/images/1mi6o12000b5md1d77B69.png,Anonymous User,"I feel that no matter what show South Korea watches, it is a bit like a male group and a female group, but it has a viewable nature and can be seen.",5.0,2024-08-21 17:22:01
30633519,https://ak-d.tripcdn.com/images/1mi6o12000b5md1d77B69.png,Anonymous User,"Nice, very creative",5.0,2024-07-07 02:20:32
30633519,https://ak-d.tripcdn.com/images/1i54412000dex20ub5452.jpg,153***33,"Yes, the family likes to watch it too, I can&rsquo;t think of this show for many years.",5.0,2024-08-14 12:01:29
30633519,https://ak-d.tripcdn.com/images/1i53212000dex236aF023.jpg,118***74,"Modern and traditional, set of small products, musical instruments, magic, acrobatics, worth watching",5.0,2024-08-13 12:17:00
30633519,https://ak-d.tripcdn.com/images/1i50h12000dex2cnoF179.jpg,M65***37,"Funny and funny performances, suitable for people of any age.",5.0,2024-04-16 14:49:40
30633519,https://ak-d.tripcdn.com/images/1i54d12000dex2bvn9345.jpg,E51***45,"A fun experience that was well cooked up. we enjoyed it. though main language wasn&rsquo;t English, it is a real testament that food has no language barriers!",5.0,2024-08-30 01:21:32
30633519,https://ak-d.tripcdn.com/images/1mi6o12000b5md1d77B69.png,Anonymous User,The booking through Trip.com was easy and fuss free.Then show started on time and it was very entertaining.&nbsp; &nbsp;You do not need to understand korean to enjoy the show.&nbsp; Lots of actions and laughter.&nbsp; Highly recommended.,5.0,2024-08-04 11:34:02
30633519,https://ak-d.tripcdn.com/images/0a25v22349trwrcgg5D6C.jpg,Jocelyn Neo Hui Yuan,"It&rsquo;s really fun! Bought my family there and they really enjoyed the performance, really quite worth it! Hughly recommend everyone to try it for at least once",5.0,2024-06-29 12:06:34
30633519,https://ak-d.tripcdn.com/images/0a26o22348md5kub47011.jpg,IcyDarkRain,super funny and organised performance thought you might not understand the show as its perform in Korean language but most of time the action and expression was just on point that you definitely understood and burst out laughing out loud!,5.0,2024-06-14 11:04:04
30633519,https://ak-d.tripcdn.com/images/0a24w224x8vhkzbm52C93.jpg,Sanbanktravel,entertaining for the whole family!! no need to know korean&hellip; mostly body languages and pure laughter!! chefs are so full of expressions and energy!! love it!!,5.0,2024-06-05 11:26:32
30633519,https://ak-d.tripcdn.com/images/0a24112000bds87sa7D13.jpg,Mimi baby 09,"I went with a friend of mine. we had a great time. lots of laughing. there&rsquo;s no talking in the show, lots of physical humor and music being made. very talented cast.  the cast also rotates. I would definitely recommend people go watch the show.",5.0,2024-02-24 10:35:22
30633519,https://ak-d.tripcdn.com/images/fd/headphoto/g3/M03/0E/B7/CggYGlXfAR-ARsXgAAGsid5drLc765.jpg,小芸宅婆,"It is worth seeing, VIP tickets are more than 200, an hour and a half of the performance is interesting, laughter is four, you can understand without language",5.0,2024-06-04 19:55:01
30633519,https://ak-d.tripcdn.com/images/fd/headphoto/g4/M00/6C/53/CggYHVZ7NpuAR8BPAAAZr7ehOD8266.jpg,jiongj,The performance is very good and the ticket is very convenient,5.0,2024-07-12 10:07:32
30633519,https://ak-d.tripcdn.com/images/Z80v0q000000gwtxu66FF.jpg,137***48,This show is worth watching.,5.0,2024-07-03 01:37:07
30633519,https://ak-d.tripcdn.com/images/1mi6o12000b5md1d77B69.png,Anonymous User,The performance was great and I admired the actors. The performance was about an hour and a half and I was very happy to bring my family to see it.,5.0,2024-06-23 16:56:07
30633519,https://ak-d.tripcdn.com/images/0Z81u120008p4ifet5AD6.jpg,Jasmine_dai520,It&#39;s wonderful and worth a visit.,5.0,2024-08-30 14:31:39
30633519,https://ak-d.tripcdn.com/images/1i53212000dex236aF023.jpg,113***36,Very passionate performance,5.0,2024-08-01 15:01:19
30633519,https://ak-d.tripcdn.com/images/1i55t12000dex1sw610BA.jpg,_We***65,"Good experience, good experience",5.0,2024-04-02 19:32:25
30633519,https://ak-d.tripcdn.com/images/1i52g12000dex1hwn04E3.jpg,135***05,Well worth seeing.,5.0,2024-07-02 07:35:35
30633519,https://ak-d.tripcdn.com/images/1i50112000dex2eb2B282.jpg,_cb***57,Worth coming.,5.0,2024-04-21 16:40:30
30633519,https://ak-d.tripcdn.com/images/1mi6o12000b5md1d77B69.png,Anonymous User,"Performances that don&#39;t need language to understand, actors perform well, and my friends and I laugh very happily.",4.0,2024-08-22 16:22:37
30633519,https://ak-d.tripcdn.com/images/1i55a12000dex2inkB7FE.jpg,Kaderinnna,"A funny show full laughter and music. Worth a visit. Alone, with friends or family.",5.0,2024-07-05 11:07:08
30633519,https://ak-d.tripcdn.com/images/Z80c0w000000kt74jD307.jpg,cherrysun82,"More suitable for parent-child travel, in Myeongdong Night Market Street, you can go and see if you are tired.",4.0,2024-05-06 12:24:34
30633519,https://ak-d.tripcdn.com/images/1i53212000dex236aF023.jpg,_FB***44,Excellent performance. Just that they remove the photo taking with actor,5.0,2024-04-19 18:03:07
30633519,https://ak-d.tripcdn.com/images/1i55t12000dex1sw610BA.jpg,M14***22,"Still interesting, accompany the children to see. Buy tickets in advance and it can be cheaper. This show is very famous in South Korea and worth a look",5.0,2024-02-17 14:53:34
30633519,https://ak-d.tripcdn.com/images/1i50112000dex2eb2B282.jpg,oz_hurricane,"Well worth the time and money, it&#39;s next door to a sport shoe store.",5.0,2024-05-16 19:50:26
30633519,https://ak-d.tripcdn.com/images/1mi6o12000b5md1d77B69.png,Anonymous User,"Not bad, the seat is a bit unreasonable",4.0,2024-07-24 20:22:33
30633519,https://ak-d.tripcdn.com/images/1i55a12000dex2inkB7FE.jpg,206***89,Very worth a visit! The live sound effects and lighting are very good. The actors are very dedicated and professional. They can also watch well if they don&#39;t understand Korean. The elderly and children are suitable. The sense of interaction on the spot is also very good.,5.0,2024-02-22 10:29:10
30633519,https://ak-d.tripcdn.com/images/zc0e170000011go8z7956.jpg,CCLioLeo,Will be okay,4.0,2024-08-03 17:49:08
30633519,https://ak-d.tripcdn.com/images/1i54d12000dex2bvn9345.jpg,M22***18,"You must see it in Korea, it is very beautiful.",5.0,2024-02-23 00:48:41
30633519,https://ak-d.tripcdn.com/images/1mi6o12000b5md1d77B69.png,Anonymous User,"Very good, no urine points throughout the hour and a half. The musical is very innovative, has a good interaction, and the applause is constant during the performance. Unfortunately, I can&#39;t take pictures on the spot, and I can&#39;t share the performance, but it really surprises people.",5.0,2024-01-08 08:55:46
30633519,https://ak-d.tripcdn.com/images/1h647120009614072C81C.jpg,猫鼬史坦克,"Very wonderful, 90 minutes of performance, still not enough",5.0,2024-04-04 11:10:16
30633519,https://ak-d.tripcdn.com/images/0a21p224x8vuug667A10A.jpg,N.K.N,"It was a funny show with a good performance, friendly audience contact and good services.",4.0,2024-08-19 15:42:06
30633519,https://ak-d.tripcdn.com/images/0a23r2224v505auwg72A2.jpg,Chuck69,Worth every penny.  The VIP seats are at first 2 rows.Price cheaper if use Seoul discovery card cos of 20% discount.,5.0,2024-01-13 13:30:47
30633519,https://ak-d.tripcdn.com/images/1i54412000dex20ub5452.jpg,Rayhkg,An impressive experience to watch show.,5.0,2024-05-22 05:36:17
30633519,https://ak-d.tripcdn.com/images/Z80i0x000000l3euz9247.jpg,小可爱的我哈哈哈,"It&#39;s fun, a different experience.",5.0,2024-04-06 16:31:38
30633519,https://ak-d.tripcdn.com/images/0a21x224x8vkvylerCFBC.jpg,Janice loy,This show nice and funnyI like so much,5.0,2024-07-12 10:40:48
30633519,https://ak-d.tripcdn.com/images/1mi6o12000b5md1d77B69.png,Anonymous User,Very fun! Hahaha 😆,5.0,2024-02-26 14:25:46
30633519,https://ak-d.tripcdn.com/images/t1/headphoto/647/727/778/652a4bff8eb0407d91798a5874c7c8c7.jpg,Calvin Li,"Ok, I think it&rsquo;s so-so",5.0,2024-02-11 15:56:35
30633519,https://ak-d.tripcdn.com/images/1mi6o12000b5md1d77B69.png,Anonymous User,"It is worth a visit. I have seen it twice, once for the company team building, and once for taking friends. The elderly are still suitable, and they smile constantly throughout the whole process. At Myeongdong Station, the subway is just a few minutes away. It is very convenient. It is optimistic that it is the snack street.",5.0,2023-12-25 23:29:00
30633519,https://ak-d.tripcdn.com/images/Z80h0o000000emkj4E4DE.jpg,纤纤大脸猫,"Nice, feel it again.",5.0,2024-02-14 13:03:57
30633519,https://ak-d.tripcdn.com/images/1i50112000dex2eb2B282.jpg,M51***21,Very good experience,5.0,2024-03-31 03:24:04
30633519,https://ak-d.tripcdn.com/images/0Z82d12000bvd90v2BBC8.jpg,摩絲好貴,Well worth seeing.,5.0,2024-03-30 19:13:13
30633519,https://ak-d.tripcdn.com/images/1i55t12000dex1sw610BA.jpg,_TI***is,Excellent!!!!!,5.0,2024-08-24 11:44:46
30633519,https://ak-d.tripcdn.com/images/1mi6o12000b5md1d77B69.png,Anonymous User,👍👍👍👍👍,5.0,2024-08-24 21:55:03
30633519,https://ak-d.tripcdn.com/images/t1/headphoto/293/406/308/22631089f44a497495c005fce85f6a6f.jpg,Kylie Oz,Fantastic show. Didn&rsquo;t expect much but turned into laughing all the way from the beginning to the end. Highly recommend even you know nothing about Korean language like us,5.0,2023-12-12 06:39:54
30633519,https://ak-d.tripcdn.com/images/1i55a12000dex2inkB7FE.jpg,M22***51,The actors performed well and the atmosphere was great!,5.0,2023-12-19 20:45:58
30633519,https://ak-d.tripcdn.com/images/1i54d12000dex2bvn9345.jpg,_TX***0z,"Good performance,  great show and comedy!",4.0,2024-06-20 19:18:29
30633519,https://ak-d.tripcdn.com/images/fd/headphoto/g4/M01/A0/1F/CggYHlY07dKAdj6SAACU0lBSqaA189.jpg,sunny,"The experience is great, it is recommended",5.0,2024-01-07 13:09:42
30633519,https://ak-d.tripcdn.com/images/Z80911000000qpinaA15A.jpg,laiannie,can go see,4.0,2024-02-13 22:03:46
30633519,https://ak-d.tripcdn.com/images/1mi6o12000b5md1d77B69.png,Anonymous User,"Take my parents, they love it.",5.0,2024-01-29 09:42:06
30633519,https://ak-d.tripcdn.com/images/1i50h12000dex2cnoF179.jpg,M36***16,"Wonderful, funny, good value for money.",5.0,2024-01-09 14:21:53
30633519,https://ak-d.tripcdn.com/images/1h60z12000ami1m2d9F31.jpg,不帅不酷又矮没钱的大叔,"Personally think that the random show is a must-see show in Seoul! Located in the center of Seoul Myeongdong, the gate is on the pedestrian street. If the navigation leads you to the alley behind, it looks like the building has been abandoned. You don&#39;t have to worry, just detour the front door. It is recommended to book tickets online so that you can get better seats. VIP seats are recommended, after all, the reality show is too far away to see! 3 handsome guys and a beautiful MM starring, there is also a very accent boss, the normal performance is very entertaining, you will be very happy!",5.0,2022-12-02 09:08:32
30633519,https://ak-d.tripcdn.com/images/0Z86212000cd5hec72313.jpg,E32***03,"Generally not worth it, it is a knocking method of the main performance, just a stage for four people",3.0,2024-04-10 10:38:27
30633519,https://ak-d.tripcdn.com/images/1mi6o12000b5md1d77B69.png,Anonymous User,Good show,4.0,2024-07-30 16:18:48
30633519,https://ak-d.tripcdn.com/images/1mi6o12000b5md1d77B69.png,Anonymous User,Easy to redeem. Enjoyed the show,5.0,2024-03-30 01:02:59
30633519,https://ak-d.tripcdn.com/images/1i50h12000dex2cnoF179.jpg,M51***65,Nice performance.,5.0,2024-01-17 11:08:57
30633519,https://ak-d.tripcdn.com/images/1i54412000dex20ub5452.jpg,139***50,Basically satisfied.,5.0,2024-01-06 00:25:48
30633519,https://ak-d.tripcdn.com/images/1i55t12000dex1sw610BA.jpg,_We***73,"Very good, very worth it",5.0,2024-01-01 22:42:33
30633519,https://ak-d.tripcdn.com/images/1mi6o12000b5md1d77B69.png,Anonymous User,Worth watching.,5.0,2023-12-27 13:32:20
30633519,https://ak-d.tripcdn.com/images/1i54412000dex20ub5452.jpg,118***20,The show is pretty good,5.0,2024-01-14 16:49:19
30633519,https://ak-d.tripcdn.com/images/a20d170000011eto78062.jpg,Kaila_,We found it so entertaining and really enjoyable! Not a show just for kids. As adults we loved it.,5.0,2024-01-03 20:51:11
30633519,https://ak-d.tripcdn.com/images/1i54412000dex20ub5452.jpg,110***19,"Overall satisfaction, gave the middle of the last row, the theater is in the center of the business district, very easy to find.",4.0,2023-12-07 09:11:38
30633519,https://ak-d.tripcdn.com/images/t1/headphoto/699/910/854/683dab66bb374136af9930ea204dfc7e.jpg,_TS***7a,Great package. Fun for everyone.,4.0,2024-04-01 16:14:35
30633519,https://ak-d.tripcdn.com/images/1mi6o12000b5md1d77B69.png,Anonymous User,"Nanta was definitely worth our time, it was easy to locate near Myeongdong",4.0,2024-01-23 09:22:30
30633519,https://ak-d.tripcdn.com/images/0a24x4215fjzc9kuoC28E.jpg,Thomas1789,Funny show!,5.0,2024-02-10 05:34:42
30633519,https://ak-d.tripcdn.com/images/1mi6o12000b5md1d77B69.png,Anonymous User,not bad! Worth seeing.,4.0,2024-09-21 21:54:28
30633519,https://ak-d.tripcdn.com/images/zc0o170000011crio5D00.jpg,我是肉松超人,"Originally thought that Xiaohongshu was full of water troops, but I found that this performance was really classic! From the plot, stage design, actor professionalism and dedication, almost all are full marks, and the atmosphere on the scene is full. Especially suitable for families!",5.0,2023-09-10 12:00:28
30633519,https://ak-d.tripcdn.com/images/1i55t12000dex1sw610BA.jpg,M27***33,"A super shocking performance, there are surprises everywhere, children especially like it. The actors&#39; performances are very hard, although there are only five people, but they also have a percussion orchestra feeling, and the actors&#39; body is also superb. It is worth everyone to watch.",5.0,2023-07-23 10:02:07
30633519,https://ak-d.tripcdn.com/images/1i55a12000dex2inkB7FE.jpg,_M1***01,"Highly recommended, really worth seeing, suitable for all ages, that is, the theater air conditioning is a bit sufficient, the actors&#39; sports intensity is very large, the performance is full of sweat, but I shivered, but it does not affect my appreciation of the performance.",5.0,2023-08-27 23:07:54
87555,https://ak-d.tripcdn.com/images/0a25g224x8x5ifk1k36D3.jpg,Fang96,"very touristy and hanbok place! this place is very crowded even at 3-4pm, so be sure to head there early for better view and photo!",5.0,2024-10-26 18:31:32
87555,https://ak-d.tripcdn.com/images/0a22w224x8x5hiy8aCBE0.jpg,Jwen-12,"I loved the transitional house with its iconic and unique style! It&rsquo;s a fantastic spot for photos, especially if you wear a traditional Korean hanbok along the street to capture a moment of the past. Plus, there are plenty of lovely cafes where you can relax and enjoy a cup of coffee.",4.0,2024-10-26 16:33:15
87555,https://ak-d.tripcdn.com/images/0a228424x8x1qsky59E32.jpg,Sasha_aa,"this is the most atmospheric place in seoul. you can rent a national costume and take a million beautiful photos. fashionable shops in restored traditional korean houses look very impressive. but remember people live there, so you need to keep quiet. the nearest metro station is anguk. i have been to seoul about 10 times and every time i find a new unexplored street in bukchon",5.0,2024-10-20 21:01:03
87555,https://ak-d.tripcdn.com/images/0a21412000d2io8pj050F.jpg,_TS***nl,"There are a lot of photogenic places. Since it is one of the famous tourist attractions, they charge a bit expensively (like 20% premium I would say; I know this because I am Korean). Also some Hanbok rental places are very rude (even to me, so for foreign visitors, they will express a lot of fury), but once you pay expensively for some unsatisfactory services, you get to understand. The moment to leave is such a memorable experience. I would recommend it but be prepared.",4.0,2024-08-21 09:55:50
87555,https://ak-d.tripcdn.com/images/1i55t12000dex1sw610BA.jpg,_TS***gg,"it&#39;s a village of homes. Korean style house, you walk through the village and that&#39;s it.  it&#39;s nice place to visit and a lot of eating places close by as well .",4.0,2024-08-16 19:49:17
87555,https://ak-d.tripcdn.com/images/1i55a12000dex2inkB7FE.jpg,102***62,"North Village Hanok Village is very worth seeing, only here, can really have a sense of immersion, in the past immersed in the Korean drama. And here is clean, quiet, narrow lanes, slowly stretching upwards, drizzle, we visited the North Village Hanok Village, the drizzle did not stop the pace of tourists to visit, in front of us and behind can always come to visit from different countries. Guest. Because I have seen the travel guide before I came, I know that there are still residents living normally here, so everyone visited quietly, and the whole gave people a feeling of one person. Very enjoyable and highly recommended. This is typical Seoul! 典型 Korea!",5.0,2024-02-17 20:09:18
87555,https://ak-d.tripcdn.com/images/0a21n224x8tnmhlqh9D8F.jpg,watching your smiles,"What a wonderful moments at Bukchon Hanok Village at Jongno District, Seoul, South Korea. Hanok is a traditional Korean architecture and There&#39;s quite unique to know about how distinct and special Korean Design is mix from Chinese and Japanese Designs. Hopefully i could be there again.",4.0,2024-01-14 00:34:28
87555,https://ak-d.tripcdn.com/images/1h62t12000d3ok7z53144.jpg,旅行生活体验,North Village Hanok Village retains tradition and is antique. Walk in it and feel the Hanok style. The main point is the original Korean traditional architecture and the quiet street atmosphere. It is a good place to experience Korean traditional culture.,5.0,2024-10-28 21:25:56
87555,https://ak-d.tripcdn.com/images/0a23n2224wj1wc36o8D60.jpg,Ligayatotheworld,amazing experience wearing their traditional outfit. went there on november and it is cold. reached the place during sunset thats why theres not much people.,5.0,2024-01-14 22:30:35
87555,https://ak-d.tripcdn.com/images/0a25m2215gxg3vlcw1DE5.jpg,The Pinky,"Bukchon Hanok Village is a residential neighborhood in Jongno District, Seoul, South Korea. It has many restored traditional Korean houses, called hanok. This has made it a popular tourist destination, which has caused some friction with the residents who live there.",5.0,2024-01-06 00:11:04
87555,https://ak-d.tripcdn.com/images/0a26c2224wjvdhe3l2A5F.jpg,Quest Journey,"Bukchon Hanok Village in Seoul is a captivating blend of tradition and charm. The narrow alleys lined with beautifully preserved hanoks offer a glimpse into Korea&#39;s rich cultural heritage. Exploring the quaint tea houses, art galleries, and traditional craft shops adds a delightful touch. The village&#39;s panoramic views of Seoul and the timeless beauty of its architecture make it a must-visit destination. 🏡🌸🇰🇷",5.0,2023-12-12 17:52:14
87555,https://ak-d.tripcdn.com/images/0a25u424x8ufxxsw7C6C1.jpg,T Esther,"Wandering through Bukchon Hanok Village, I stepped into the soul of Seoul&#39;s past. Traditional hanoks lined narrow alleyways, a living canvas of Korea&#39;s architectural heritage. Each twist and turn revealed a new perspective&mdash;ancient palaces peeking through, vibrant tea houses, and locals preserving cultural crafts. As sunlight filtered through tiled rooftops, the village whispered tales of centuries gone by. Bukchon Hanok Village, a harmonious blend of tradition and modernity, invites all to experience Seoul&#39;s timeless charm.",5.0,2023-12-03 03:16:47
87555,https://ak-d.tripcdn.com/images/0a25a2215h0zeoimp71D8.jpg,Nasrin Mohd,"Surrounded by Gyeongbokgung Palace, Changdeokgung Palace and Jongmyo Shrine, Bukchon Hanok Village is home to hundreds of traditional houses, called hanok, that date back to the Joseon dynasty. The name Bukchon, which literally translates to &quot;northern village,&quot; came about as the neighborhood lies north of two significant Seoul landmarks, Cheonggyecheon Stream and Jongno.",5.0,2023-12-02 11:13:12
87555,https://ak-d.tripcdn.com/images/0a22322349mk0bn3kE818.jpg,WJ TYK,"Nice traditional wooden hanok buildings.... Bukchon Hanok Village is a great place to visit in Seoul, South Korea, i will come back and visit again soon!",5.0,2024-01-18 18:00:22
87555,https://ak-d.tripcdn.com/images/1i55t12000dex1sw610BA.jpg,AnonymousUser123,"All the houses in the village maintained the old design, look out for friendly visitor info staff that hand out useful walking maps.",5.0,2024-01-12 00:28:23
87555,https://ak-d.tripcdn.com/images/0a20v4215g6giscps56AD.jpg,吉在格拉,"this village is a residential neighborhood in Jongno District, Seoul. It has many restored tradition Korean houses.",5.0,2023-12-13 06:36:34
87555,https://ak-d.tripcdn.com/images/0a2572224w8obma5c7297.jpg,sarmadallawati,The place is perfect for photography but there&rsquo;s one problem with it&rsquo;s super crowded so hard to take good shots here.,5.0,2024-01-03 09:38:16
87555,https://ak-d.tripcdn.com/images/0a24c324x8tl96y9xB1D8.jpg,RikainChina,Beautiful area and neighborhood! The walking around was pleasant. definitely a must visit if you are in Seoul!,5.0,2024-01-29 14:33:36
87555,https://ak-d.tripcdn.com/images/0a225224x8tl2wj909135.jpg,Annnnn_7,Bukchon Hanok Village - a popular tourist attraction home to many traditional Korean houses,5.0,2023-12-18 20:22:12
87555,https://ak-d.tripcdn.com/images/0a24n424x8tqwp8v189CC.jpg,HHthen,A traditional village inside the urban area. Got some hostel and restaurants,5.0,2023-11-21 02:10:16
87555,https://ak-d.tripcdn.com/images/0Z84j120009ch758i2603.jpg,Sukarno,"North Village Hanok Village is still very Korean. It is a north-south street, but if you visit Hanok Village, you need to enter the fork road on both sides of the east and west. It is all uphill. There are many small shops on the roadside. There are also red flowers. There are many beautiful women who shoot Hanok.",5.0,2023-09-05 10:53:52
87555,https://ak-d.tripcdn.com/images/Z80c180000013yew14864.jpg,zrth.thr,The place is accessible by public transport. Nice walking experience and can enjoy traditional and antique house design.,4.0,2024-01-12 12:50:31
87555,https://ak-d.tripcdn.com/images/0a23f223498prwwog9A47.jpg,Sallykristine Loo,"𝑩𝒖𝒌𝒄𝒉𝒐𝒏, 𝒘𝒉𝒆𝒓𝒆 𝒚𝒐𝒖 𝒄𝒂𝒏 𝒇𝒆𝒆𝒍 𝒕𝒉𝒆 𝒃𝒆𝒂𝒖𝒕𝒚 𝒂𝒏𝒅 𝒄𝒉𝒂𝒓𝒎𝒔 𝒐𝒇 𝑯𝒂𝒏𝒐𝒌🧡&lsquo;Bukchon&rsquo; originally referred to the neighborhood located north of Cheonggyecheon Stream and Jongno. It is a village where the relatives of royal families and powerful Yangban (aristocrats) families of the Joseon Dynasty lived 600 years ago. Nowadays, residents who live in Bukchon are preserving the Hanok village.As you walk through the alleys of Bukchon, you can encounter eight scenic views of Bukchon that boast wonderful scenery. There are also several photo spots for visitors! 📸Spend a relaxing time among the Hanoks while enjoying the eight scenic views of Bukchon where you can capture all the colors and atmosphere of Hanoks.✨Bukchon Hanok Village📌 Location: 37, Gyedong-gil, Jongno-gu, Seoul",5.0,2023-10-02 21:34:45
87555,https://ak-d.tripcdn.com/images/0a2112224r2zvvdhsB25C.jpg,Dr Nas,"we head to Bukchon Hanok Village. We are given half an hour here&hellip;&ldquo;Surrounded by Gyeongbokgung Palace, Changdeokgung Palace and Jongmyo Shrine, Bukchon Hanok Village is home to hundreds of traditional houses, called hanok, that date back to the Joseon dynasty. The name Bukchon, which literally translates to &quot;northern village,&quot; came about as the neighborhood lies north of two significant Seoul landmarks, Cheonggyecheon Stream and Jongno. Today, many of these hanoks operate as cultural centers, guesthouses, restaurants and tea houses, providing visitors with an opportunity to experience, learn and immerse themselves in traditional Korean culture. As Bukchon Hanok Village is an actual neighborhood with people&#39;s homes, visitors are advised to be respectful at all times while looking around.&rdquo; (english.visitkorea.or.kr)PS: There are signs about respect in the neighbourhood, and a couple of uniformed persons stationed to keep the noise level down from some easily excitable tourists. There aren&rsquo;t too many people around, to be fair, as it&rsquo;s been raining so it&rsquo;s relatively quiet.",5.0,2023-05-15 10:56:41
87555,https://ak-d.tripcdn.com/images/0a26f22346gz4190w6AF0.jpg,NuNu.ss,"quiet village,beautiful scenery,many tourists,you must keep his rules,not noisy,because the house is really someone living.",5.0,2022-09-07 15:12:29
