place_id,head_image,user_name,content,user_rating,create_time
56042759,https://ak-d.tripcdn.com/images/0a25z224x8ub67xwuA71F.jpg,덥다더워용,Good to go with children in autumn,5.0,2023-01-13 21:57:59
95955582,https://ak-d.tripcdn.com/images/0a21v2234dg97ktjkE6C4.jpg,용혜작가,"A good place to go out to the suburbs of Seoul. Even if you visit Siheung Gaetgol Ecological Park in all four seasons, it is a place that shows a fairy tale-like scenery. It&#39;s a good place to travel with your family, and the parking lot is also a good place to use because the public parking lot is good :) tip: Personally, the sunset is a beautiful place",5.0,2023-04-10 17:02:21
95955582,https://ak-d.tripcdn.com/images/Z80u1e000001fjqsc6D59.jpg,fenguilin,"It is said that the scenery here is very good, have the opportunity to see it.",5.0,2023-08-25 19:35:35
95955582,https://ak-d.tripcdn.com/images/0a2212215d6fdjx4gFA9A.jpg,쏭이맘,"Siheung Gaetgol Ecological Park Pink Muhly is very pretty in autumn. The reeds are also pretty, and I think autumn is the prettiest among spring, summer, autumn and winter.",5.0,2023-02-01 20:49:15
95955582,https://ak-d.tripcdn.com/images/0a2472215bj79e1gw5C79.jpg,짜누스,It&#39;s always a fun place to go.Weekend parking is hard but good,5.0,2022-07-04 19:43:06
95955582,https://ak-d.tripcdn.com/images/0a24q2215dyjbzc01380B.jpg,March Ivan,love this place especially during spring time,5.0,2023-02-09 20:49:34
95955582,https://ak-d.tripcdn.com/images/0a264223499gyqls07C08.jpg,뭐하고놀까,It&#39;s really pretty when it&#39;s sunset at Gaetgol Ecological Park!!,5.0,2022-11-21 17:57:19
