place_id,head_image,user_name,content,user_rating,create_time
99590686,https://ak-d.tripcdn.com/images/0a25c4234cxsxjgy87E05.jpg,cryptoet,"There&#39;s a swimming pool, there&#39;s a restaurant on the ground floor, there&#39;s coffee, and there&#39;s coffee on the ground floor, 1,500 won.",5.0,2023-01-18 10:05:55
99590686,https://ak-d.tripcdn.com/images/0a249224x8u4ea3ka8DB4.jpg,TourdeMonde,"It&#39;s spacious and nice. It&#39;s indoors, so you can enjoy the game less affected by the weather.",4.0,2023-02-21 23:53:50
22846448,https://ak-d.tripcdn.com/images/0a26g2224t7cyudhc5F7E.jpg,소비탐구생활,"Parking is convenient. The cafe inside is good, and the amenities are neat.",5.0,2022-11-25 01:08:15
22846448,https://ak-d.tripcdn.com/images/1i54d12000dex2bvn9345.jpg,M32***83,"The collection is very rich, and there are many precious ancient books.",5.0,2022-01-05 01:17:36
22846448,https://ak-d.tripcdn.com/images/Z80q0z000000mogzc91DD.jpg,Amy_zhang9,"Books are relatively complete, clean, clean and comfortable environment, can calm down to read favorite books, increase knowledge, broaden horizons, but also purify the mind, let the heart get calm.",5.0,2017-12-27 21:14:35
22846448,https://ak-d.tripcdn.com/images/Z80v0b0000005oflx4C3F.jpg,AURURA木木,It&#39;s so big. Go in and feel it. It&#39;s decided that the facilities are really great. You can&#39;t read the books. Foreigners can go in.,5.0,2017-05-28 23:03:18
22846448,https://ak-d.tripcdn.com/images/Z80v0b0000005oflx4C3F.jpg,AURURA木木,"In the city center, I looked at it when I passed by. The environment was very good, especially the air-conditioning inside was very good.",5.0,2018-05-30 00:47:09
22846448,https://ak-d.tripcdn.com/images/t1/headphoto/651/990/790/2d73b27832da408db2862d937a468fbf.jpg,E35***63,"National Library, although books are Korean and English, I can not understand, but I like the feeling of visiting the library, like to stay in it.",4.0,2016-05-04 14:57:12
58282573,https://ak-d.tripcdn.com/images/0a25a12000amcua8y728B.jpg,TravellerM,"My friend brought me here and we had a good laugh. The museum&rsquo;s main focus is the significance of the toilet. It was actually quite an interesting museum and I ended up learning quite a bit. In addition, I like how the museum had a sections on sanitation and environmentally friendly toilets. The museum has a strong mission. One which could easily be looked down on or made fun of, but it&rsquo;s worth visiting, not only for the laughs!",4.0,2023-03-17 02:05:58
