place_id,head_image,user_name,content,user_rating,create_time
10521755,https://ak-d.tripcdn.com/images/0a25z12000emy91nl9871.jpg,Traveling Zeta,Beautiful place to visit lots of exhibits to see. Great place to hang out during the hot summer. I would definitely recommend the aquarium as a must see on your travel list.,5.0,2024-08-04 02:49:44
10521755,https://ak-d.tripcdn.com/images/0a254224x8vvqp7e09DE7.jpg,Fadi.culop,"First visit to Coex Aquarium🐠Coex shopping mall is really worth visiting!The largest comprehensive shopping mall in Seoul🇰🇷There are various shopping malls, gourmet restaurants, and cafes inside☕️A spectacular starry sky library designed with a huge book wall✨📚If you are tired of shopping, you can also take a dream water trip to heal your body and mind🪸It is completely the first choice for indoor entertainment itineraries!Not so good inside the aquarium!But there are many theme areasYou can walk around for about 2 hoursThe most beautiful thing is the undersea tunnel💙 I like it so much🫶🏻Several Korean dramas were filmed here!Suitable for parent-child travel, couples&#39; dates, and best friends&#39; travels",5.0,2024-08-16 17:38:14
10521755,https://ak-d.tripcdn.com/images/1i55t12000dex1sw610BA.jpg,_TI***33,I recommend for visitors to come here. So creative and cute! I was using DSP to the max and went to COEX Aquarium as one of the free places. I totally didnt regret my decision. This is one of the best places for me with my toddler.,5.0,2024-06-02 20:51:55
10521755,https://ak-d.tripcdn.com/images/0a26x224x8v7r2xhi7B9B.jpg,Jenno,,5.0,2024-06-09 17:48:36
10521755,https://ak-d.tripcdn.com/images/0a23m224x8v09i33uA22B.jpg,Hyenam,"Stunning aquarium! The aquarium is spacious,with a wide variety of fish. They also have this stamp thing where you stamp at each location you go to. I probably spent a good 3-4 hours here. Highly recommend 🥹",5.0,2024-05-27 13:24:22
10521755,https://ak-d.tripcdn.com/images/1i54412000dex20ub5452.jpg,WAI SING,"First time visiting this place...it&#39;s located inside Coex Mall..No queues,even though it&#39;s the weekend (New Year&#39;s Eve)..The aquarium is spacious,with a wide variety of fish..The spatial arrangement is good,and the most interesting part for kids is the fish pond where they can put their hands in...Extremely clean.Highly recommend for children&#39;s recreation 👍👍",5.0,2024-05-07 21:20:00
10521755,https://ak-d.tripcdn.com/images/0a246224x8uzn4s778922.jpg,iamwiing,,5.0,2024-08-26 17:01:57
10521755,https://ak-d.tripcdn.com/images/0a20s2234c9vaavb4AA16.jpg,0010 พงษ์พันธ์ มูลมงคล,,5.0,2024-06-13 17:49:47
10521755,https://ak-d.tripcdn.com/images/0a26z2234d0eni39s8CEB.jpg,Gigiegg,"The variety of marine life on display, from colorful fish to majestic sharks, was fascinating to see up close. The themed exhibits, like the underwater tunnel, provided immersive and educational experiences. The aquarium is well-maintained and offers something for visitors of all ages to enjoy.",5.0,2024-05-29 00:10:24
10521755,https://ak-d.tripcdn.com/images/0a212224x8un5vbnb3EF6.jpg,lauraverwa,"Many animals to see in naturalish habitat. Feeding schedule is posted, crowds will form. Crocodile is impressive.&nbsp;Low arches and ceilings, watch head. Recommended",5.0,2024-05-08 18:06:23
10521755,https://ak-d.tripcdn.com/images/0a22a224x8ufcob5pA37D.jpg,hermanhito,"There was plenty of feeding times and a pretty mermaid show. I probably spent a good 3-4 hours here.&nbsp;If you come here as a couple, there were cute mirrors to take pics with your spouse.",5.0,2024-05-08 16:42:42
10521755,https://ak-d.tripcdn.com/images/0a215224x8ufcw9iuEA45.jpg,laurafanita,I loved this aquarium! It was the best experience I&#39;ve had so far! There were so much to see and do. They have this stamp thing where you stamp at each location you go to.,5.0,2024-05-08 15:39:58
10521755,https://ak-d.tripcdn.com/images/0a25p2224v3uj4bds9EB3.jpg,Huemin,"COEX Aquarium is one of South Korea&#39;s largest and most popular aquariums, located in the bustling COEX Mall in Seoul. The aquarium offers a captivating experience with a wide range of marine life and unique exhibits. It houses over 40,000 marine creatures across more than 650 species, including fish, mammals, reptiles, and amphibians. The aquarium is divided into themed zones such as the Amazonian World, Garden of Korea, and the Deep Blue Ocean, each showcasing different underwater habitats.",5.0,2024-05-08 09:11:17
10521755,https://ak-d.tripcdn.com/images/0a22i224x8ufca5j7386F.jpg,gitarewan,"First time visiting this place. It&#39;s located inside Coex Mall,&nbsp;no queues,even though it&#39;s the weekend (New Year&#39;s Eve).&nbsp;The aquarium is spacious,with a wide variety of fish. Recommended to come here",5.0,2024-05-07 15:44:54
10521755,https://ak-d.tripcdn.com/images/0a24b224x8ufbxqb90CBA.jpg,kamaridali,"Fantastic place to visit, great for small kids too, they have inside plenty of activities for the little ones to do. Can feed some of the fish too, they also have shows like when they have feeding timing",5.0,2024-05-06 19:40:16
10521755,https://ak-d.tripcdn.com/images/0a22p224x8uppplpd0E47.jpg,Anjelie lil red bean,"This place is fantastic to visit, and it&#39;s especially enjoyable for young children. Inside, there are numerous activities tailored for the little ones to enjoy. Kids can even have the opportunity to feed some of the fish and witness special shows, such as feeding times.",5.0,2024-05-05 18:56:59
10521755,https://ak-d.tripcdn.com/images/1i54412000dex20ub5452.jpg,YEW SING,"Fantastic place to visit, great for small kids too, they have inside plenty of activities for the little ones to do. Can feed some of the fish too, they also have shows like when they have feeding timing for them.",5.0,2024-05-05 14:34:08
10521755,https://ak-d.tripcdn.com/images/0a217224x8un8pakxD063.jpg,Zhuilima7716,"The Coex Aquarium is a mesmerizing haven for those enchanted by marine wonders. With its vast array of captivating fish and sea creatures, it offers an immersive journey into the depths of the ocean. From vibrant tropical fish to majestic sharks and graceful stingrays, every tank holds a diverse display of fascinating species. The aquarium&#39;s carefully crafted exhibits not only entertain but also educate visitors about various ecosystems and conservation efforts. Whether you&#39;re a passionate marine enthusiast or simply seeking a delightful outing, the Coex Aquarium guarantees an unforgettable exploration of underwater marvels. Prepare to be enchanted and enlightened as you dive into the mesmerizing world beneath the waves.",5.0,2024-04-30 11:59:57
10521755,https://ak-d.tripcdn.com/images/0a251224x8uoe3ll2C8CC.jpg,DC 蔡大少,Nice quick visit while checking out coed and star field mall. Friendly for the kids. Visiting there right after open (10:00am) is the best if you want to take your time to enjoy it,4.0,2024-05-02 21:10:00
10521755,https://ak-d.tripcdn.com/images/0a24s2234d4ul33z5E1C6.jpg,shermaineee,"Stepping into Coex Aquarium was like diving into a vibrant underwater world. From colorful fish to graceful sharks, every tank was a new adventure. The underwater tunnel was especially cool!",4.0,2024-05-13 22:42:32
10521755,https://ak-d.tripcdn.com/images/0a21h224x8u3g16wl4BB9.jpg,Jasoncerfon,"Coex Aquarium is a delightful underwater adventure, brimming with fun and joy! The vibrant marine life, interactive exhibits, and engaging presentations make it a perfect family outing.",5.0,2024-04-07 09:15:12
10521755,https://ak-d.tripcdn.com/images/0a20g224x8u3rxfss595C.jpg,Jeffryderson,there is lockers which u can use with coins. which help us lessen a lot of burden as we got a lot of winter coats. the fish display are nice and a lot of variety,5.0,2024-04-07 08:14:30
10521755,https://ak-d.tripcdn.com/images/0a22c224x8u2xgwdr0FA1.jpg,Hermiverdo,The Coex aquarium has a lot of variety of sea life to look at with various different and interesting exhibitions along with it,5.0,2024-04-07 05:20:16
10521755,https://ak-d.tripcdn.com/images/0a25g224x8tq8itlrE36A.jpg,YSL5725,"A must visit place if you go to Korea with your kids. they enjoyed it so much. another different experience for them as each country that we went, we will definitely pay a visit to sea aquarium.",4.0,2024-03-12 19:00:53
10521755,https://ak-d.tripcdn.com/images/1i50h12000dex2cnoF179.jpg,M80***95,"Sure enough, every time I feel very fresh, although the aquarium area is not large, but it is very delicate. I am still very happy to come here after five years.",5.0,2024-08-13 04:46:24
10521755,https://ak-d.tripcdn.com/images/1i55a12000dex2inkB7FE.jpg,_We***41,"If you have been to a large aquarium in China, it feels so-so here. Fortunately, the children like it very much, it is a bit small, and the meaning is still not enough. But it&rsquo;s okay to go shopping with you. 👌.",4.0,2024-05-31 19:11:51
10521755,https://ak-d.tripcdn.com/images/0a219224x8wcxlz6zDA34.jpg,Mommy who loves travelling,aquarium is a bit small and limited sea creatures to see. hence the entrance tix is a bit too pricey for the size and variety of the aquarium,3.0,2024-08-05 16:17:44
10521755,https://ak-d.tripcdn.com/images/0a23p2215cpx94uowF9F1.jpg,Xin21,"Many pretty sea creatures and it is so beautiful with many marine creatures for discovery, great place for families, wanted to catch the show, but many ended! will go next time!",4.0,2024-02-23 09:50:15
10521755,https://ak-d.tripcdn.com/images/0a2222215gh03a2tcD985.jpg,ᄋᄉᄋbernice,It was so fun and there were so many different animals &amp; exhibits for you to look at! There was a good mix of immersive experiences and animal sightings from both land and water animals. A great visit for all ages!,5.0,2024-01-28 11:47:43
10521755,https://ak-d.tripcdn.com/images/0a20z2215crqqiog04C1C.jpg,Joon Chai,Nice sea aquarium that seated in the middle of Seoul City. it house many big fishes and some unique species that keep the visitors entertained and amazed.,5.0,2024-01-27 14:05:23
10521755,https://ak-d.tripcdn.com/images/1i54b12000dex2gdeE7AD.jpg,cpi***ry,"Very good, good experience.",5.0,2024-08-06 00:25:14
10521755,https://ak-d.tripcdn.com/images/0a2584234c5uefqi8415F.jpg,Arrow_,"It was a trip to Korea with friends and we visited COEX Aquarium. I always love to visit different Aquarium from around the world and I found this one very interesting.COEX Aquarium 📍 513 Yeongdong-daero, Gangnam-gu, Seoul, South Korea",4.0,2024-03-01 16:29:12
10521755,https://ak-d.tripcdn.com/images/0a21j224x8v0wwz1o54A9.jpg,Mr.Rivera,this place was huge and it felt like a adventure seeing all the many different types of fish and animals. definitely worth more than you think it is. perfect for kids lots of cool stuff to see it&rsquo;s not just fish but also the set up of everything was so cool,5.0,2024-05-26 09:49:33
10521755,https://ak-d.tripcdn.com/images/0a25e22345aba6slc7C47.jpg,LYvonne,"Nice instagramable aquarium with lots of photo spots. Lots of colourful fish in big aquarium tanks, and also a lot of smaller interesting tank setups such as fish tanks in the refrigerator, bookshelves, inside a telephone booth and more.",5.0,2024-02-05 12:36:07
10521755,https://ak-d.tripcdn.com/images/1mi6o12000b5md1d77B69.png,Anonymous User,"The aquarium is especially suitable for children who study, teach and enjoy, the small food and ice cream sold in the restaurant are particularly delicious and not expensive, the children like it very much!",5.0,2024-08-12 18:01:14
10521755,https://ak-d.tripcdn.com/images/0a22r2224x0k1cbpcCCCD.jpg,Niques,"It was so so so fun to go there, they have so many kinds on animals and also theres a part for lego collections. We also can write our wish on the notes tree.",5.0,2024-05-16 17:58:54
10521755,https://ak-d.tripcdn.com/images/1i54d12000dex2bvn9345.jpg,_FB***58,"Nice &amp; big aquarium, there were many interesting things to see . Spent about 2hours here . It&rsquo;s inside a mall so you can shop afterwards 😊",5.0,2024-01-27 01:44:53
10521755,https://ak-d.tripcdn.com/images/1i53212000dex236aF023.jpg,M40***53,"I don&#39;t know how the local ocean park in South Korea is. At least now the facilities in the aquarium have been set up. The children still have a good time. But compared with the domestic large aquarium, it is a little inferior.",4.0,2024-08-26 15:59:58
10521755,https://ak-d.tripcdn.com/images/1i50h12000dex2cnoF179.jpg,talent20020,"Ok, compared to Chimelong is definitely bullying, but Seoul has no fun attractions, with children, in addition to Aibao and Lotte, here is also worth a visit.",5.0,2024-08-10 21:45:16
10521755,https://ak-d.tripcdn.com/images/0a20j224x8w739p193E5D.jpg,nylej,I love their aquarium  💕💕 you can enjoy at the same time learn 💕💕they have a cute stuff you can buy in their souvenir store💕💕💕,5.0,2024-09-04 21:14:09
10521755,https://ak-d.tripcdn.com/images/1i55t12000dex1sw610BA.jpg,_TI***9e,Quite a nice relaxing place to stroll along and if you&#39;re already visiting the library then might as well make a visit here too,4.0,2024-05-05 12:10:49
10521755,https://ak-d.tripcdn.com/images/0a247224x8ubzybogEE4B.jpg,YaqoobAhmadenggcf,Stunning environment,5.0,2024-08-04 06:14:40
10521755,https://ak-d.tripcdn.com/images/1i52g12000dex1hwn04E3.jpg,158***16,Kids love this place,5.0,2024-09-01 01:31:15
10521755,https://ak-d.tripcdn.com/images/1i54d12000dex2bvn9345.jpg,爱旅游的猫先森_,Take the kids to see,5.0,2024-08-27 17:28:08
10521755,https://ak-d.tripcdn.com/images/0a24y224x8uftjx992FBD.jpg,Nozimakhon,very good and beautiful place. Aquarium is sooooo big and I liked it. Staff can speak little English which is very helpful yaay,5.0,2024-09-01 03:41:08
10521755,https://ak-d.tripcdn.com/images/1i53212000dex236aF023.jpg,Yerin0203,,5.0,2024-07-29 02:58:03
10521755,https://ak-d.tripcdn.com/images/1i50h12000dex2cnoF179.jpg,_TI***yd,Overall it is good and suitable for those who like indoor activities. The aquarium is inside the mall and very convenient.,5.0,2024-06-04 02:43:09
10521755,https://ak-d.tripcdn.com/images/1i50h12000dex2cnoF179.jpg,talent20020,"It is worth going with children, not as good as domestic, but not bad",5.0,2024-08-10 21:51:48
10521755,https://ak-d.tripcdn.com/images/0Z86y224x8trbegiv6CED.jpg,Yvette-y,"Very beautiful, there are many types of fish, the environment is not bad, but the overall is not very big, the whole process is about an hour and a half",5.0,2024-01-13 21:32:38
10521755,https://ak-d.tripcdn.com/images/1i50112000dex2eb2B282.jpg,136***85,"Easy to use, value to see the aquarium.",5.0,2024-05-20 13:19:25
10521755,https://ak-d.tripcdn.com/images/1i54412000dex20ub5452.jpg,77Andre,"Generally boring, you can go",5.0,2024-05-04 13:28:51
10521755,https://ak-d.tripcdn.com/images/1h63912000asahe3o7030.jpg,usamill,It&#39;s worth going to a good ～,5.0,2024-08-13 15:32:28
10521755,https://ak-d.tripcdn.com/images/1h61b120008oensszE011.jpg,Post Rocker,"Very good, very powerful.",5.0,2024-08-27 17:54:08
10521755,https://ak-d.tripcdn.com/images/1mi6o12000b5md1d77B69.png,Anonymous User,"Very fun, it is worth a visit. The scenery is unique. Adults and children are very happy. It is especially suitable for traveling. I often go out to play. The mood will become particularly good. Hey, I look forward to the next trip.",5.0,2023-11-21 10:54:16
10521755,https://ak-d.tripcdn.com/images/1mi6o12000b5md1d77B69.png,Anonymous User,The aquarium is worth the visit. Just ensure to check on timings of the shows. For instance the mermaid show timing and days that they are showing.,4.0,2024-05-27 13:09:33
10521755,https://ak-d.tripcdn.com/images/1i54d12000dex2bvn9345.jpg,_TI***b5,,5.0,2024-02-27 05:49:28
10521755,https://ak-d.tripcdn.com/images/1i55a12000dex2inkB7FE.jpg,_We***00,I think the fare is not worth it.,4.0,2024-08-14 01:34:18
10521755,https://ak-d.tripcdn.com/images/0a21m2224xc9o583k8A03.jpg,BSTan,A great Aquarium with many marine animals to explore.,5.0,2024-06-10 09:59:21
10521755,https://ak-d.tripcdn.com/images/0a20y224x8vcu089u6020.jpg,aOm.,,5.0,2024-06-18 11:13:01
10521755,https://ak-d.tripcdn.com/images/0a24h424x8w88hdxs114D.jpg,Yaqeen,Reasons to Recommend:I really like this place,5.0,2024-09-05 16:25:09
10521755,https://ak-d.tripcdn.com/images/0a211224x8ttc1l443DAC.jpg,Travelogist,It&#39;s an extremely good spot don&#39;t miss itGood for family time and good for peace of mind while seeing the sea creatures.,5.0,2024-03-16 12:14:02
10521755,https://ak-d.tripcdn.com/images/t1/headphoto/521/000/448/36bec645038e4ca2bea0b5871a185f4a.jpg,prawn0818,A good place for bringing children to experience up close,5.0,2024-03-19 13:00:33
10521755,https://ak-d.tripcdn.com/images/1h62t12000d3ok7z53144.jpg,旅行生活体验,"COEX Aquarium is large and diverse. The undersea tunnel is amazing and the interactive experience is interesting. The main point is the rich marine life and wonderful display. It is a must-see for parents and children, marine lovers.",5.0,2024-10-28 21:26:33
10521755,https://ak-d.tripcdn.com/images/0a25m224x8w0vwmi34F3E.jpg,MisterAriff,I visit this aquarium as part of my Seoul Travel Pass and i love it! The aquarium itself is simply beautiful.,5.0,2023-11-29 17:38:41
10521755,https://ak-d.tripcdn.com/images/1i54d12000dex2bvn9345.jpg,pauljan,Nice place to visit during summer,5.0,2024-08-07 21:30:44
10521755,https://ak-d.tripcdn.com/images/1i50112000dex2eb2B282.jpg,M51***21,Very good experience,5.0,2024-03-31 03:24:32
10521755,https://ak-d.tripcdn.com/images/1i50112000dex2eb2B282.jpg,OCHIR URTNASAN,nice to visit there super,5.0,2024-07-10 15:02:20
10521755,https://ak-d.tripcdn.com/images/0a22e224x8vj8y87qB71C.jpg,Jum safa,"The COEX Aquarium is one of South Korea&#39;s largest and most famous aquariums, located in the COEX Mall in the Gangnam district of Seoul. It features a wide variety of marine life from around the world and offers visitors an immersive experience through its themed zones.",5.0,2024-09-22 04:08:57
10521755,https://ak-d.tripcdn.com/images/1i54d12000dex2bvn9345.jpg,_TS***82,"Went there in the summer of 2023, it was nice there was lots of different fish, some sharks and other marine creatures there. The aquarium isn&rsquo;t too big that it is tiring , but it&rsquo;s not tiny either , it&rsquo;s a great place to spend an afternoon.",4.0,2024-09-19 00:33:09
10521755,https://ak-d.tripcdn.com/images/0a25g224x8tq8itlrE36A.jpg,YSL5725,worth for money. really different with some other places and the kids loved and enjoyed it so much. can make your own bracelet or accessories with the choices of pearl available.,5.0,2024-04-10 23:51:11
10521755,https://ak-d.tripcdn.com/images/1i54412000dex20ub5452.jpg,M26***72,Yes or moderate price,5.0,2023-11-21 17:53:03
10521755,https://ak-d.tripcdn.com/images/1mi6o12000b5md1d77B69.png,Anonymous User,Very nice,5.0,2024-04-12 01:54:00
10521755,https://ak-d.tripcdn.com/images/0a270224x8uq8ulabAFD1.jpg,Puai Than,the aquarium is a nice place to visit for kids and family.,4.0,2024-05-08 20:37:56
10521755,https://ak-d.tripcdn.com/images/0a23w224x8w5c3l0q1DF8.jpg,my name Kdey,cute,5.0,2024-08-31 06:39:39
10521755,https://ak-d.tripcdn.com/images/1i55t12000dex1sw610BA.jpg,파루크아만,Awesome place for explorer,5.0,2023-12-19 01:17:36
10521755,https://ak-d.tripcdn.com/images/0a22s324x8wi8ofhwD9C1.jpg,trump K,"Good.The tunnel under the water with the sharks swimming around wasn&#39;t as nice was the one in Guam. There was a decent variety of aquatics and I keep getting the vibes that place was geared for kids, with the Octonauts Cartoon theme throughout.  There are seats for rest in a few areas. One hour here is enough.",5.0,2024-09-24 11:51:33
10521755,https://ak-d.tripcdn.com/images/0a26x424x8vutsl6sFE0A.jpg,A_Becca,Very nice aquarium. Ideal for family outings.,4.0,2024-08-06 23:55:54
10521755,https://ak-d.tripcdn.com/images/1mi6o12000b5md1d77B69.png,Anonymous User,Felt like it was targeted mostly kids,4.0,2024-05-16 20:27:48
10521755,https://ak-d.tripcdn.com/images/0a25y224x8vonyy0vE709.jpg,Enqsqn,Tips: Overpriced but would recommend visiting.,3.0,2024-07-22 07:36:01
10521755,https://ak-d.tripcdn.com/images/0a254224x8u896tbsCED6.jpg,ShrewdGenius,Very nice place. Went suring the christmas period and they had christmas theme all over. Tickets were reasonably priced with a large variety of fishes,5.0,2024-03-13 08:30:19
10521755,https://ak-d.tripcdn.com/images/1i54b12000dex2gdeE7AD.jpg,danielmll,"Very good, the place is not convenient for shopping, suitable for family travel",5.0,2024-01-05 11:33:38
10521755,https://ak-d.tripcdn.com/images/1i54b12000dex2gdeE7AD.jpg,danielmll,"It&rsquo;s not a fun place, I&rsquo;ve seen it in an hour.",5.0,2024-01-05 11:33:13
10521755,https://ak-d.tripcdn.com/images/1mi6o12000b5md1d77B69.png,Anonymous User,User friendly. Highly recommended,5.0,2024-02-29 01:18:44
10521755,https://ak-d.tripcdn.com/images/1mi6o12000b5md1d77B69.png,Anonymous User,Easy to book. Highly recommended,5.0,2024-02-29 01:17:34
10521755,https://ak-d.tripcdn.com/images/1mi6o12000b5md1d77B69.png,Anonymous User,Very satisfied!,5.0,2023-12-30 23:41:37
10521755,https://ak-d.tripcdn.com/images/0a25412000artt56g559D.jpg,Muhammad S,"Displays are well organised and informative &amp; a section you will find the large tank where you can sit and watch the sharks, Exhibits were well displayed &amp; children would enjoy it very much. There is also a section named The Amazonia is fascinating. There&rsquo;s penguins, prairie dogs and manatees too. It is a good place for a half day trip. It is quite deceptive in its size, as when you enter the aquarium there is a child like vibe in terms of displays and colours.It&rsquo;s a good place to visit especially if cold/ wet weather and need an indoor activity. Recommend as worth visiting.",3.0,2024-10-01 22:53:08
10521755,https://ak-d.tripcdn.com/images/0a2442234b1tguqxc8334.jpg,View2datop,"The aquatic has many aquatic animals. Arrange a cute light atmosphere, suitable for children to learn, there is a fish feeding show. And other youngsters around there are souvenirs for sale in front and exit",5.0,2023-06-01 03:03:25
10521755,https://ak-d.tripcdn.com/images/0a22h224x8u4t9rlzEC35.jpg,_TX***7j,Similar with Jeju&rsquo;s aquarium but smaller.,4.0,2024-03-27 16:13:29
10521755,https://ak-d.tripcdn.com/images/0a22x224x8u0hh6wd3822.jpg,Qichen,good,5.0,2024-03-23 06:57:41
10521755,https://ak-d.tripcdn.com/images/1mi6o12000b5md1d77B69.png,Anonymous User,Place is pretty great to see sea creatures.,4.0,2024-04-10 18:32:37
10521755,https://ak-d.tripcdn.com/images/0a25q2224v1xbl3ls3784.jpg,Thuý kòi,it was amazing.little guys can see big fish under the ocean,5.0,2023-06-07 15:40:47
10521755,https://ak-d.tripcdn.com/images/0a23x423474mrroggAAC1.jpg,cristina cabrera torres,The place is super recommended!! I enjoyed it a lot with my friends.❤️ The animals were in great condition and well treated 💖😽very cute,5.0,2022-12-02 11:15:51
10521755,https://ak-d.tripcdn.com/images/a20e14000000w4rfn2E0E.jpg,Vnes,Absolutely Fantastic!!! From the front it looks underwhelming but as you make your way through there a so many surprises (not just fish) the place is huge. I wish I hadn&#39;t spent so much time at the start of the aquarium as I had to rush through the end which had so much to see. I would definitely come here again,5.0,2023-10-02 17:19:11
10521755,https://ak-d.tripcdn.com/images/0a2262224p7zeqnq85EEA.jpg,eat.to.be.joy,The coex aquarium is located at Sancheng Station. It is very large and it takes a day to see it. The marine life is very beautiful and it is so close to see.,5.0,2023-06-06 01:09:57
10521755,https://ak-d.tripcdn.com/images/0a21d2234b2oojunk0CCD.jpg,Pamie,"Very suitable for bringing children together, parent-child friendly environment, and interactive experience. It is very convenient to connect with shopping mall for transportation, eating and shopping.",5.0,2023-05-04 23:16:16
10521755,https://ak-d.tripcdn.com/images/0a26r2215h36n2k5s5EF9.jpg,Minarti lina,"I didn&#39;t expect that in the middle of the mall there was an aquarium. The place is clean, comfortable and cool. In front of it, it doesn&#39;t look big, but when you enter the area, it turns out... the fish collection is quite complete... we have made the aquarium as attractive and creative as possible. Kids will definitely love it...",5.0,2023-10-10 09:29:46
10521755,https://ak-d.tripcdn.com/images/0a2212215d6fdjx4gFA9A.jpg,쏭이맘,"It&#39;s great to see all kinds of marine animals, and it&#39;s easy to go by public transportation, and there are plenty of places to eat when you pack food.",5.0,2023-02-01 09:02:59
50583507,https://ak-d.tripcdn.com/images/1i54d12000dex2bvn9345.jpg,_TI***cz,Went to Seoul Korea in May 2024 with the best temperature in the 60s and went to Starfield Library COEX Mall. The place was not crowded and the people take turns in going up the elevator to take pictures,5.0,2024-09-06 23:52:04
50583507,https://ak-d.tripcdn.com/images/0a255224x8w59y6sgA235.jpg,Emma Fasci,"Reasons to Recommend: it&rsquo;s a massive 2 story, 2,800 square metre sprawling space full of light and glass50,000 books fantastically decorate 3 towering bookshelves, each standing a whopping 13 metres tallrotating centrepieces have included a kitschy fruit / veggie tree and a gorgeous tower of booksthere are almost 600 domestic and foreign magazines available for browsingthe owner, Shinsegae, invested 6 billion won to develop and create the Starfield Libraryit will cost 500 mil won",5.0,2024-08-31 04:10:45
