place_id,head_image,user_name,content,user_rating,create_time
78916,https://ak-d.tripcdn.com/images/1i55a12000dex2inkB7FE.jpg,Miss Berna,very therapeutic views from here. such a spectacular nature walk from the bottom of the mountain. a must visit for Kdrama fans,5.0,2024-11-02 06:14:02
78916,https://ak-d.tripcdn.com/images/0a228424x8x1qsky59E32.jpg,Sasha_aa,"the road itself from the metro to the park, and then to the tower is very interesting, with painted walls. you can just walk in the park without buying a ticket to the tower.",5.0,2024-10-21 17:15:28
78916,https://ak-d.tripcdn.com/images/0a21j224x8ukougdw260E.jpg,Andrewng,"one of Seoul&rsquo;s best, the view is superb and the cable car is amazing too. I wished I had spent more time strolling around. worth many visits",5.0,2024-10-21 00:26:14
78916,https://ak-d.tripcdn.com/images/zc0p170000011d1zy24F3.jpg,_We***52,"To be honest, the price of the whole TV tower is like this. Haha 😃, you can see the whole Seoul, but the scenery and playability are just like that. After all, it is a TV tower, but I am still very satisfied. I mainly think that the fare is too expensive. The discount of Alipay tickets is nearly one person. 100 Money!",5.0,2024-08-22 20:20:41
78916,https://ak-d.tripcdn.com/images/0Z84g12000b70ecq160CA.jpg,摇摇,"Cable car up the mountain, buy tickets to climb the tower. Although not as good as Shanghai&#39;s Oriental Pearl, it overlooks the entire downtown Seoul. It may not be as good as the night view at night during the day! Time is limited, I tasted the ice cream of the Seoul Tower, it was delicious.",5.0,2024-08-24 07:48:39
78916,https://ak-d.tripcdn.com/images/1i54d12000dex2bvn9345.jpg,M33***35,"It is equivalent to the Oriental Pearl, but the price is much cheaper than the Oriental Pearl.",5.0,2024-08-24 23:30:49
78916,https://ak-d.tripcdn.com/images/1mi6o12000b5md1d77B69.png,Anonymous User,"Tickets bought at the QR code of Trip.com swiped at the ticket office. It&#39;s a high tower. After going up, there is nothing to see, but Seoul itself has nothing to see. If you come to see it, you can see it if you have no other place. It&#39;s not expensive anyway. People there don&#39;t speak English. If you encounter some problems, it is a bit difficult to ask someone.",5.0,2024-08-25 14:32:00
78916,https://ak-d.tripcdn.com/images/1mi6o12000b5md1d77B69.png,Anonymous User,"The night view of the attraction is good. The traffic on the way up can be introduced better. The cable car and bus are better informed. In addition, there are Trip.com direct purchases that can be discounted. However, confirm with the on-site service staff that the exchange of purchases on the spot is not accepted. As a result, you can only scan the code again, and it is also a jump to Trip.com , but the price is expensive.",4.0,2024-07-21 00:14:11
78916,https://ak-d.tripcdn.com/images/1i55t12000dex1sw610BA.jpg,_We***47,"Very good experience, must go to the tower",5.0,2024-09-05 09:57:20
78916,https://ak-d.tripcdn.com/images/0a2132215h47nbdo06525.jpg,wetpaint,"Very peaceful and beautiful park in Central Seoul. Perfect if you want a slice of nature within the centre. if you&#39;re feeling ambitious, you can do the 2.5km trek up to Seoul Tower!",5.0,2023-11-23 09:56:31
78916,https://ak-d.tripcdn.com/images/1h62t12000d3ok7z53144.jpg,旅行生活体验,"Nanshan Park has beautiful scenery and fresh air. The mountains are rolling and tree-lined, making it a good place to relax. The main points are the natural landscape scenery and quiet atmosphere. You can stroll around and enjoy a pleasant time.",5.0,2024-10-29 23:47:46
78916,https://ak-d.tripcdn.com/images/0a246224x8uzn4s778922.jpg,iamwiing,,4.0,2024-09-11 13:59:48
78916,https://ak-d.tripcdn.com/images/1mi6o12000b5md1d77B69.png,Anonymous User,"Nanshan Tower is one of Seoul&#39;s classic attractions. You can buy tickets at the ticket office at the bottom of the tower. There is a manual ticket office, you can also choose to scan the code to buy tickets at Trip.com , and there will be staff to help write off. The elevator can only sit on the fifth floor, and then go up to a French restaurant, which cannot be reached by ordinary browsing. When taking the elevator, the staff will invite you to watch the small short film in the elevator, but the short film speed is very fast, the content is also general, it looks a bit dizzy... to the fifth floor overlooking the city scenery, densely arranged. There are also cultural and creative sales on the fifth floor, and the price is relatively reasonable, similar to the price of domestic scenic spots.",5.0,2024-09-14 10:15:42
78916,https://ak-d.tripcdn.com/images/0a2682224slw5law0C6A6.jpg,보라군,The best place where various cultures and life are intricately intertwined. There are the best walking trails and sports courses in Seoul. Seoul from the bottom of Namsan Tower is by far the best,5.0,2023-06-01 07:19:08
78916,https://ak-d.tripcdn.com/images/0a26u2215fups974gCF42.jpg,mktc,"I was able to take a leisurely walk while the wind was blowing occasionally under the cherry blossoms in full bloom and the petals were fluttering. The road surface is well maintained and the road width is wide, so I was able to take a walk while taking pictures without worrying even if there were many people. I wanted to come to see the cherry blossoms again next year.",5.0,2023-04-05 10:05:44
78916,https://ak-d.tripcdn.com/images/0a2462215ejmu2qxt7DEB.jpg,Kimmy Yana,Pick season of Cherry blossom🌸namsan mountain park. fresh place that you can refresh your stress even walking only. Many different kinds of flowers,5.0,2023-04-04 01:20:14
78916,https://ak-d.tripcdn.com/images/0a21b2224u2s1h7sg0117.jpg,A_G,"Seoul N Tower 🗼 that appeared in the drama. There are many fun memories I visited with my family. In September of this year, I visited with my nephew. The view from Nanzan is really dramatic. There are things that were fun, things that were painful, and things that are fulfilling. I have become an adult with this scenery. I think so.",5.0,2023-02-28 23:56:30
78916,https://ak-d.tripcdn.com/images/0a22o224x8w7gcf5h6B06.jpg,KGKAI,"How to get to N Seoul Tower (How to go to N Seoul Tower)Seoul Travel, South Korea Travel, South Korea Useful, Useful Information / Chungmuro ​​Station, Dongguk Univ. Station, Hangangjin Station, Itaewon Station, Mountains and Cave, Myeongdong Station, Namsan, Seoul Station, Seoul Subway 1, Seoul Subway 3, Seoul Subway 4, Seoul Subway 6, Tower, scenic spot, Seoul Travel attractions, free admission, Travel to Korea by yourself N Seoul Tower (엔 서울타워) is officially named YTN Seoul Tower (YTN Seoul Tower). It is a watchtower located on Namsan Mountain and is the second highest point in Seoul (Seoul), a city in the local area of Gyeonggi Prefecture (Gyeonggido, Gyeonggi-do in South Korea today. N Seoul Tower is considered a landmark. one of the important symbols and became a popular tourist destination which almost every tourist must visit with a point where you can see the scenery and the scenery of Angong The beauty of Seoul is different from each period. of each season",5.0,2023-01-09 23:37:24
78916,https://ak-d.tripcdn.com/images/0a24u2215bxeyp1tc404E.jpg,York San,"The N Seoul Tower (Korean: N 서울타워), officially the YTN Seoul Tower and commonly known as Namsan Tower or Seoul Tower, is a communication and observation tower located on Nam Mountain in central Seoul, South Korea. The 236-meter (774 ft)-tall tower marks the second highest point in Seoul.Built in 1969, the N Seoul Tower is South Korea&#39;s first general radio wave tower, providing TV and radio broadcasting in Seoul. Currently, the tower broadcasts signals for Korean media outlets, such as KBS, MBC, and SBS.",5.0,2022-07-12 20:39:30
78916,https://ak-d.tripcdn.com/images/a20ihk124bbkfubow4BB7.jpg,Kokô Korea,It has come up. cool atmosphere See the view of Seoul,5.0,2023-05-31 16:25:18
78916,https://ak-d.tripcdn.com/images/0a20a22348h372a9d0F58.jpg,han,"360-degree angle view of Seoul city. there is a cable car ride to go up there, but I personally recommend hiking up there. it takes only 20mins (max 30mins) and have a cable car ride back down.  think everyone knows it&#39;s a must go spot in seoul.",5.0,2023-08-23 00:24:52
78916,https://ak-d.tripcdn.com/images/0Z86s120008in2gngCE0D.jpg,徐徐霞客Rr,"South Korea&#39;s Nanshan Park, there is an iconic building in this park, which is the Seoul Tower. This park is still relatively beautiful. If you go in the spring season, it will be very dazzling and the greening is still very good.",5.0,2022-08-17 00:57:47
78916,https://ak-d.tripcdn.com/images/0a20r2224u2nm01ow9B0D.jpg,Si Lei,"We went to the Namsan Tower at night, took a bus that bring us right below the tower but we will need to walk uphill to reach the bottom of the tower. we took a lift all the way up and had an amazing view of Seoul. Night view is really good!",5.0,2023-02-01 02:41:52
78916,https://ak-d.tripcdn.com/images/0a20l2224o0nxizds1822.jpg,Corgiwithfood,"To count to the landmarks of Seoul, there must be Nanshan Park. Among them, Nanshan Tower is also a must-see attraction. You can take the cable car to have a panoramic view of Seoul. The fare is 8,500 won for adults. The night view is the most beautiful. The elevator operation time is 09:00 ～ 23: 00 Zhong, many couples will go to the love lock platform, the main characters of the series Qian Songyi and Du Minjun have to go to the lover lock side to take the scene 🤣 Address: 3 Nanshan Park Lane, Longshan District, Seoul Special City (Thick Rock Cave)",4.0,2022-10-28 16:47:43
78916,https://ak-d.tripcdn.com/images/1i50112000dex2eb2B282.jpg,건느님,"I think it&#39;s the best place to take a walk in Seoul. If you like hiking, it&#39;s great to go up to Namsan Tower and walk along the Pyeonggil.",5.0,2023-05-02 01:05:43
78916,https://ak-d.tripcdn.com/images/0a2372215dzu5nhmoF670.jpg,熟悉的陌生人,"You can choose to take the cable car to climb the mountain. I chose to walk slowly to the mountain after the hotel. When the evening comes, you can enjoy the day and night view at a time, praise!",5.0,2023-02-13 02:00:00
78916,https://ak-d.tripcdn.com/images/0a20h2224u8wg4xoxF5D5.jpg,YiRuWang,"After eating, before it is dark, walk two minutes from the shelter, the sunset is beautiful, there is not much crowd, by the way, digest the barbecue for dinner ❤️ very comfortable ❤️",5.0,2023-04-27 11:26:17
78916,https://ak-d.tripcdn.com/images/0a24l22348uopkneo667B.jpg,BBD,"Namsan Mountain Park is an absolute gem in the heart of Seoul. 🌳 The scenic trails, lush greenery, and panoramic views of the city are nothing short of spectacular. Whether you&#39;re hiking up to the summit, strolling through the beautiful gardens, or visiting N Seoul Tower, there&#39;s something for everyone to enjoy. It&#39;s a peaceful escape from the hustle and bustle of the city, and the perfect spot for nature lovers and photographers. Don&#39;t miss the chance to experience this tranquil oasis! 🏞️🌇 #NamsanMagic #SeoulInNature",4.0,2023-10-29 01:57:47
78916,https://ak-d.tripcdn.com/images/0a2292215eewnfrhc645B.jpg,새우123,"Namsan from Namsan and Inwangsan. Namsan, a mountain that is perfect for exercising. If you come down without being high or low, Namsan, where Myeongdong Namdaemun is located..",5.0,2023-03-26 14:10:55
78916,https://ak-d.tripcdn.com/images/0a23u2215crmzjhw09F7C.jpg,Happiness in eating,Best View from Namsan TOWER TOP The pictures say it all.,5.0,2022-10-24 17:28:17
78916,https://ak-d.tripcdn.com/images/0a25q2224v1xbl3ls3784.jpg,Thuý kòi,"it&#39;s bad here you can see seoul city, the weather is cool and the scenery is beautiful",5.0,2023-06-07 15:37:29
78916,https://ak-d.tripcdn.com/images/0a23t2224uxm2om0g37DB.jpg,台北男子 Aries,Take the subway to Myeongdong Station and walk 15~20 minutes to the foot of Nanshan Mountain. You can also take the cable car up the mountain. You can also choose to take the bus from Myeongdong Station or climb the mountain by yourself. It is worth a walk!,5.0,2023-06-05 17:49:13
78916,https://ak-d.tripcdn.com/images/0a20322345r9um8e846A6.jpg,Hú Dương,"I really like this place, whether it&#39;s a day or night view",5.0,2023-06-03 00:57:00
78916,https://ak-d.tripcdn.com/images/0a23b2224tzct0n0gDA36.jpg,Libertas,"Namsan Park has different charms all seasons, but it&#39;s best to go in spring. Be sure to enjoy the harmony of beautiful castles and cherry blossoms!",5.0,2023-02-03 10:38:39
78916,https://ak-d.tripcdn.com/images/0a21c224x8vftwy1xB0B3.jpg,幼恩,"The scenery is very good, I don&rsquo;t want to climb the mountain and have a cable car to take it up. The only thing to pay attention to is that it is best to plan the time to take the cable car down early, because when the cable car is about to end, everyone will squeeze it down for about an hour (･᷄ὢ･᷅)",5.0,2022-09-23 11:54:22
78916,https://ak-d.tripcdn.com/images/a206hk124e0mehh8w3245.jpg,Fly for peace,very nice and beautiful place I love to walk around that place and take pictures,5.0,2023-02-21 05:09:43
78916,https://ak-d.tripcdn.com/images/0a26r2215dbeeiivk94BA.jpg,쿼카구리,"Namsan Tower seems to be pretty all four seasons. Among them, I think autumn is the prettiest. The reason is that the autumn leaves are crazy.",5.0,2023-01-13 19:59:25
78916,https://ak-d.tripcdn.com/images/0a23d2215an4leupc5640.jpg,goodtogo,so many cats there. beautiful city view and good place for exercise,5.0,2022-12-13 22:39:03
78916,https://ak-d.tripcdn.com/images/0a20x22346zt07pdtDEB6.jpg,Richy vip,"The view is beautiful, there is a reasonable photo angle. Anyone who comes to Korea must come to this landmark.",5.0,2023-01-23 06:47:56
78916,https://ak-d.tripcdn.com/images/0a2592224p39kczm8E233.jpg,AlbertHuang,"Here&rsquo;s a fascinating destination with several interesting features. The N Seoul Tower is one of the main attractions on Namsan Mountain, offering stunning panoramic views of Seoul. Visitors can take a cable car or hike up the mountain to reach the tower.In addition to the tower, Namsan Park is a beautiful natural space with walking trails and lush greenery, making it a popular spot for locals and tourists alike. The park provides a peaceful escape from the hustle and bustle of the city.Furthermore, Namsangol Hanok Village is a traditional Korean village that showcases historical hanok houses and offers cultural experiences like traditional performances and crafts.Overall, Namsan is a great place to immerse yourself in Korean culture, enjoy scenic views, and explore a mix of modern and traditional attractions.",5.0,2023-07-20 17:52:39
78916,https://ak-d.tripcdn.com/images/0a2712215dqvwjqrkA30E.jpg,_GG***94,"Korea&#39;s scratching heart, there are only beautiful people everywhere walking?",5.0,2023-05-02 03:25:31
78916,https://ak-d.tripcdn.com/images/t1/headphoto/724/518/802/e201a429d7a54f72ade0df32a3d59b2f.jpg,mickey38,Seoul Nanshan Park is the famous site of the Nanshan Tower. Visitors can take a sightseeing crane to the top of the mountain to enjoy the entire appearance of Seoul. Spring season is also a good place to enjoy the cherry blossoms.,5.0,2022-08-11 05:08:55
78916,https://ak-d.tripcdn.com/images/1i50h12000dex2cnoF179.jpg,_GG***43,I&#39;ve been here many times and still get amazed with its view especially at night were you can see the cities nightlight and have scenic sights🥰🤗,5.0,2023-09-04 13:44:57
78916,https://ak-d.tripcdn.com/images/0a2202215efpn3cn489F1.jpg,Avavago,"Seoul Nanshan Park is a popular park on the mountainside of Nanshan in central Seoul overlooking the beautiful scenery of the city. This park is one of the most popular leisure and entertainment venues in Seoul, attracting a large number of tourists and local residents to visit. Nanshan Park has a very large area, which contains many trails and mountaineering routes, suitable for different levels of mountaineering enthusiasts to challenge. There are also many attractions in the park, such as the Korean Traditional Cultural Experience Village, Nanshan Tower, Korean War Memorial, etc., which can let visitors understand the history and culture of Korea. The environment of Nanshan Park is also very beautiful, with many mature trees and flowers in the park, which makes the whole park look very green. In addition, there is a beautiful stream where people can stroll and feel the beauty of nature. There are also many wildlife, such as squirrels, birds, etc., which allow visitors to observe and touch nature up close. Overall, Seoul Nanshan Park is a very beautiful and comfortable park for people of different ages to visit. The park is well equipped and has a beautiful environment that allows people to relax and enjoy the beauty of nature in the busy city. If you are looking for a place to relax yourself, Nanshan Park is a great choice.",5.0,2023-03-25 03:18:31
78916,https://ak-d.tripcdn.com/images/fd/headphoto/g5/M00/3C/AC/CggYsVaw3T-AWFV_AACpDjtgSl0058.jpg,rain,"Nanshan Park is located 265 meters above sea level in Seoul, South Korea. The top of the mountain stands the 236-meter Seoul Tower, which overlooks the central area of Seoul and is the same symbol as the Life Building. In addition to the Seoul Tower, there are also octagonal pavilions, marine aquariums, fountains, botanical gardens and Nanshan Library on the mountainside.",4.0,2023-03-02 23:35:55
78916,https://ak-d.tripcdn.com/images/0a21432348s38912o4A9A.jpg,ZION0928,it is very beautiful and a relaxing place.you can enjoy here very well. you will see the lights in the night shining,5.0,2023-04-10 21:54:54
78916,https://ak-d.tripcdn.com/images/0a2282224m0t5k29cBD43.jpg,Dianalan Amir,one of the most unforgettable travel I had in my life.  the scenery of the place Is superb.,5.0,2023-03-30 17:47:24
78916,https://ak-d.tripcdn.com/images/0a26d2234bdmz181cB59E.jpg,IVAN0108,It is really beautiful to come up to Nanshan Park overlooking downtown Seoul! Very recommended tourist must go to the attractions!,5.0,2023-02-21 17:37:19
78916,https://ak-d.tripcdn.com/images/t1/headphoto/902/265/017/f47b8f811f574408b74c238b5d249ea6.jpg,February,"The Nanshan Mountain in November is already red, and the scenery is beautiful! ____________ In addition to hiking, you can also take a cable car up and down the hill or take a green bus up and down the hill. I went to the morning, the cable car began to operate at 10 o&#39;clock, so I climbed the mountain on foot. The air was fresh and my vision was wide. There are N Seoul Tower and Octagonal Pavilion at the top of the mountain. It&#39;s the place where many TV plays are filmed. It&#39;s worth a look.",5.0,2015-11-13 18:04:32
78916,https://ak-d.tripcdn.com/images/zc0e170000011go8z7956.jpg,亮子,"Good, good, good, good, good, good, good, good, good,",5.0,2024-10-10 15:24:11
78916,https://ak-d.tripcdn.com/images/1mi6o12000b5md1d77B69.png,Anonymous User,It&rsquo;s really good to see the night view.,5.0,2024-10-05 11:50:23
78916,https://ak-d.tripcdn.com/images/1i52g12000dex1hwn04E3.jpg,Yantz,relaxing and cooling place to go,5.0,2023-06-05 16:55:24
78916,https://ak-d.tripcdn.com/images/1i50h12000dex2cnoF179.jpg,M62***59,The experience is very good,5.0,2024-09-06 22:42:08
78916,https://ak-d.tripcdn.com/images/0a20s2224ukffqidc38AA.jpg,Bren2490,Visited Namsan tower in 2018 but it seems like yesterday. It is a very good place for couples and also you can have a very good view of the City Lights from the peak!,4.0,2023-03-28 12:54:59
78916,https://ak-d.tripcdn.com/images/a20shk124cy5m0h8g3303.jpg,wyp_ivy,"As long as you have seen Korean dramas, it is not unfamiliar to the landmarks 👍🏻 The scenery is very different during the day and night, and it is very beautiful. Especially the feeling of going in the four seasons is also different.✨ But coming to Korea feels worth going to a place 🤩",5.0,2022-12-31 18:49:33
78916,https://ak-d.tripcdn.com/images/0a20q2234bc5xm5k037F7.jpg,Addao5,exploring the world,4.0,2023-01-24 16:00:21
78916,https://ak-d.tripcdn.com/images/1i53212000dex236aF023.jpg,E62***30,"Autumn can see red leaves ginkgo, straight to go",5.0,2023-05-27 23:41:37
78916,https://ak-d.tripcdn.com/images/0a23n2215dw7ve93kBE44.jpg,khsr02,"The view you see on the ropeway is superb! !! Especially recommended at night! If you have a boyfriend, please come because your heart can be locked!",5.0,2023-02-02 21:31:25
78916,https://ak-d.tripcdn.com/images/1i51e12000cadhyyw4A44.jpg,突击队长于大胆,"2011, commemorate the green years. I only remember that there are many concentric locks, dense, and there are many Chinese messages on them. I hope to have the opportunity to go with my husband once. After all, it is more interesting to travel with people I like.",5.0,2021-12-14 23:10:12
78916,https://ak-d.tripcdn.com/images/0a22a2234b383z19t7049.jpg,호캉스제일좋아,"It&#39;s a good date course. There are many gifts and souvenirs in the goods shop, so there are also things to see.",5.0,2023-04-10 01:24:18
78916,https://ak-d.tripcdn.com/images/0a207223484gmowya9B2F.jpg,쑥떡토끼,"If you eat full and walk along Namsan Dulle-gil, you can watch the night view and exercise!",5.0,2023-02-23 11:08:07
78916,https://ak-d.tripcdn.com/images/Z80h14000000wsheh9852.jpg,真诚7577,"Shenzhen Nanshan Park. Maybe most of the friends in Nanshan District, Shenzhen have been here to climb high and look at it. The whole Shenzhen Bay has a panoramic view; you can see the buildings in the central area of Shenzhen, and there are many high-rise buildings. Of course, the scenery of Nanshan Park is also quite good, with dense trees and pleasant scenery.",4.0,2021-07-09 21:51:38
78916,https://ak-d.tripcdn.com/images/0a25j2224ssbopdzlFDAC.jpg,網友增,Very beautiful and worth a visit! It is recommended to go to see the night view of Seoul at night 😍,5.0,2022-10-21 01:32:15
78916,https://ak-d.tripcdn.com/images/0a26x3224ueymnxa809F6.jpg,Camille916,You can climb up the mountain to see the beautiful scenery and Namsan Tower,5.0,2023-03-16 12:41:49
78916,https://ak-d.tripcdn.com/images/1i54d12000dex2bvn9345.jpg,D32***30,Very beautiful view on a clear day. You need to book a cable car ride to go up and down the mountain.,5.0,2023-09-10 19:26:08
78916,https://ak-d.tripcdn.com/images/1i50112000dex2eb2B282.jpg,_GG***21,"so refreshing, clean, and right place to unwind",5.0,2023-02-13 00:09:31
78916,https://ak-d.tripcdn.com/images/0Z82e120008wzxldt1129.jpg,ljkj,"Unique design style, beautiful scenery, good enjoyment!",5.0,2022-09-13 15:28:01
78916,https://ak-d.tripcdn.com/images/Z80t16000000zqfky9B31.jpg,暮雪sy,"I went to Seoul three times with my daughter, two of whom stayed at the Four Points by Sheraton, and this hotel is near Nanshan Park and it takes less than 10 minutes to walk, so we often go for a walk in this park during our stay. The park was stunning for the first time, with evergreen trees, and a seemingly ancient white stone wall erected in a different style that separated the park from the bustling city. Walk up the slope of the roadside, the sky is blue and blue, black lampposts against the white stone wall, the surrounding is very quiet, it seems to hear the sound of air vibration, time is as still. Very beautiful. At the end of the slope was the open square, with several sculptures and a memorial hall, but we didn&#39;t go in. Surprisingly, standing on the square, you can see the N Seoul Tower standing on the top of the mountain, it seems to be close at hand, and there is a climbing ladder through the square (the sign of the N Seoul Tower on the side of the square), pick up the stairs, about half an hour to reach the N Seoul Tower (the ladder is relatively gentle, Easy to climb). After visiting the N Seoul Tower, you can take the cable car down the mountain and walk for a few minutes to Myeongdong Pedestrian Street. A great experience!",5.0,2019-08-08 21:36:02
78916,https://ak-d.tripcdn.com/images/fd/headphoto/g4/M04/30/BB/CggYHFaqEs6ACV9mAADY-jGIid4231.jpg,tracy,"To climb Nanshan in the morning, there is a ramp at the foot of the mountain at the subway station. There are not many morning exercisers. The air is fresh, the birds are singing and the flowers are fragrant, and the city of Seoul can be seen faintly. The mountain is not very high, stop and go to take pictures, soon to the top of the mountain, at the foot of Seoul Tower. From the other side of the mountain, there is a station, and then take back to Mingdong, or very early, eat breakfast to the next attraction.",5.0,2016-01-30 00:20:46
78916,https://ak-d.tripcdn.com/images/fd/headphoto/g2/M03/E3/E0/Cghzf1TsBNaAawwXAAAtqbdsQkQ752.jpg,游来游去,"Seoul Park, far away, often appears in Korean dramas.",5.0,2023-03-21 13:57:24
78916,https://ak-d.tripcdn.com/images/0a26h224x8utcv461C182.jpg,종수 KIM,"It&#39;s really good. You can see downtown Seoul clearly. Sure enough, Seoul is beautiful to look down in spring.",5.0,2023-05-09 23:59:57
78916,https://ak-d.tripcdn.com/images/Z8010v000000jy23y696A.jpg,_TS***q4,"It&#39;s close to home, so I go there once, but it&#39;s a new and interesting place every time I go. It&#39;s a rare place where the view of Seoul, mountains and cities go together~~",5.0,2022-06-03 16:46:43
78916,https://ak-d.tripcdn.com/images/1i54d12000dex2bvn9345.jpg,你的大宝贝呀,"Nanshan at night is very beautiful, I went with my boyfriend, it is very worth it, I have time to go again, beautiful,",5.0,2023-04-18 17:13:45
78916,https://ak-d.tripcdn.com/images/0Z82r120008fq2wmm5DB8.jpg,pekingwang,"It&#39;s a boring place, don&#39;t come if you can&#39;t come",5.0,2022-07-28 16:57:50
78916,https://ak-d.tripcdn.com/images/0a23g2224uoxzxy8w129D.jpg,Han1330,"A must-visit destination for exercise, travel and Seoul! The photo points are also great",5.0,2023-05-04 16:13:20
