place_id,head_image,user_name,content,user_rating,create_time
10759195,https://ak-d.tripcdn.com/images/fd/headphoto/g1/M04/80/F8/CghzfFVxMS6Ad9vqAAD0OShJIUY941.jpg,安安琪琪,"I have seen similar programs in China before, and the overall is good.",5.0,2023-06-21 21:09:51
10759195,https://ak-d.tripcdn.com/images/1i53212000dex236aF023.jpg,jyh***11,"It&#39;s worth seeing! The stage effect is very good, the actors are very attentive, and the whole song and dance show is very good. And I appreciate the close-knit style of Korean actors. The main actors will invite the audience to take a photo at the entrance before the opening, and after the end, all the actors and the audience will take a photo one by one. But the booking link is more worried. I have arrived in Korea. I was still calling the international long-distance booking confirmation the day before the movie.",5.0,2014-04-20 11:53:59
10759195,https://ak-d.tripcdn.com/images/Z8060a0000004jjkoBF85.jpg,dolphinlemon,"All kinds of shows are very good, this is a random new product, marriage show, let us all experience the feeling of marriage is really tired, there are so many things to do, VIP seat you may be pulled up to a section, haha, super funny, very good performance",5.0,2014-07-14 15:57:56
10759195,https://ak-d.tripcdn.com/images/1i55a12000dex2inkB7FE.jpg,巴东元英,It was arranged that VIP seat ～ and finally was invited to dance with the actors. ～ It ended my trip to Seoul with a complete end.,5.0,2014-05-06 12:38:44
10759195,https://ak-d.tripcdn.com/images/t1/headphoto/738/070/069/3418974af8924fa1bf87d640fd3c3862.jpg,猪头修炼成的猫,"Very good show, the actors are very hardworking and very happy to watch. I recommend everyone. If you have more time in Seoul, you can go to the wedding show and the random fight show. If you only have enough time to watch one, I personally recommend the random fight show.",4.0,2014-09-25 17:08:44
10759195,https://ak-d.tripcdn.com/images/1i53212000dex236aF023.jpg,300***30,"This praise is a ticket sent by others, the performance is very novel, the plot is not bad",5.0,2018-02-08 11:50:28
10759195,https://ak-d.tripcdn.com/images/fd/headphoto/g1/M07/9C/F7/CghzfVSWctSAVNv-AABdZOtXPuw848.jpg,doridoris啦啦啦,"I haven&#39;t had it before, it&#39;s a new drama, what&#39;s funny before the messy show is more sweet!",5.0,2017-08-21 13:06:20
10759195,https://ak-d.tripcdn.com/images/0Z84j120008wnpu0s9952.jpg,jennynui,"These performances are mainly funny, a series of shows, but the content is different, mainly musicals, very distinctive feel.",4.0,2014-03-10 18:03:27
10759195,https://ak-d.tripcdn.com/images/1i55t12000dex1sw610BA.jpg,M25***77,Just calm down and watch this show with a deep aftertaste,5.0,2019-09-22 17:23:53
10759195,https://ak-d.tripcdn.com/images/fd/headphoto/g1/M04/9D/1B/CghzfFVzpUKAaQtVAADj6ZsagAE094.jpg,Robinson163,It was a new show for the team!!,5.0,2013-10-26 14:17:38
10759195,https://ak-d.tripcdn.com/images/Z80v0b0000005oflx4C3F.jpg,AURURA木木,"Originally came to Seoul to watch the messy show, the bread show, and launched a new product, good.",5.0,2018-09-22 19:01:58
10759195,https://ak-d.tripcdn.com/images/Z80g0z000000mp6870B68.jpg,Bolton1984,"Perfect stage effect, beautiful wedding dress, wonderful performance.",5.0,2018-03-13 10:47:38
10759195,https://ak-d.tripcdn.com/images/1i50112000dex2eb2B282.jpg,doudourw,"Very good show, musical instrument hit, very lively, very atmospheric.",5.0,2017-09-22 12:49:29
10759195,https://ak-d.tripcdn.com/images/1i55t12000dex1sw610BA.jpg,gjm521,"Very special place, I like this feeling very much.",5.0,2018-05-16 00:39:43
10759195,https://ak-d.tripcdn.com/images/Z8090e00000071h7q9468.jpg,Yanleec,"Watching these shows in Korea, it was very happy, very happy, although there was no dialogue, but it still made you laugh.",4.0,2013-12-31 14:26:27
65176834,https://ak-d.tripcdn.com/images/0a24m3215de9j2scw8732.jpg,그래그래,"Good facilities, clean and good view.",5.0,2023-01-10 08:34:38
22847716,https://ak-d.tripcdn.com/images/1i54d12000dex2bvn9345.jpg,M32***83,"Coming here is like coming to a natural oxygen bar, because of the rich vegetation, so the air is very good.",5.0,2022-01-10 00:32:10
22847716,https://ak-d.tripcdn.com/images/1i54d12000dex2bvn9345.jpg,M32***83,The trees here are so dense that they come in like a big oxygen bar.,5.0,2022-01-03 02:25:05
22847716,https://ak-d.tripcdn.com/images/0a20k22159spluk2o0FBE.jpg,programmer,Good for a date course. It is good for children to take a walk and the air is clear and recommended..,5.0,2022-03-05 02:07:11
22847716,https://ak-d.tripcdn.com/images/fd/headphoto/g3/M0A/12/4B/CggYGlaQswCAQP9dAAD4iv2jEiI529.jpg,老苏,"The real story - &quot;foreigners laughed at the zodiac, the Chinese people asked people to think deeply. Once, a group of Chinese people participated in the reception of a visiting group composed of European aristocrats. Most of them have kinship with the Royal family. They are very learned and cultured. They treat people politely, but there is a kind of arrogance behind their accomplishment. On the last day of dinner, they may have drunk too much, and the nobility&#39;s words and manners become more straightforward. During the dinner, a German aristocrat stood up and said, * how do you Chinese belong to pigs, dogs, rats? Unlike us, Taurus, Leo, Andromeda... I don&#39;t know what your ancestors thought. Everyone laughed and knocked glasses together, and the former elegance was completely gone. It&#39;s reasonable to say that people are scolding your ancestors. If you can&#39;t think of a counterattack, you can at least lift the table. However, all the Chinese present are silent, and they may not have responded. At this time, a Chinese man stood up and said in a calm tone - &quot;Yes, the Chinese ancestors were very real. Our twelve zodiac signs are two opposite, six reincarnations, reflecting our ancestors&#39;expectations and requirements for us. &quot; At this time, the scene atmosphere slowly quieted down, but the nobles face is still a look of indifference. The Chinese say that the first group is mice and cattle. Rats represent intelligence, cows represent diligence. Intelligence and diligence must be closely combined. If you are intelligent and not diligent, you will become smart; but if you are diligent and do not use your mind, you will become foolish. The two must be combined. This is the expectation and requirement of our ancestors to our first group, and also the most important group. &quot; The second group was tigers and rabbits. Tiger stands for bravery, rabbit for caution. Courage and prudence must be tightly combined in order to be bold and careful. If bravery leaves prudence, it becomes recklessness, but without bravery, it becomes timidity. This group is also very important, so.&quot; Chinese people look at these nobles, add a sentence - &quot;When we show caution, do not think that the Chinese people do not have a brave side. &quot; Watching everyone sink into meditation, the Chinese continue to say - &quot;The third group is dragon and snake, dragon stands for fierce, snake stands for flexibility. The so-called rigid is easy to break, too rigid is easy to break, but if only the soft side is easy to lose their own ideas, so, the combination of rigidity and softness is our ancestor&#39;s precept. &quot; Next comes the horse and the sheep. The horse represents courage and the sheep represents harmony. If a person only cares about his own goals, regardless of the surrounding environment, will inevitably continue to bump around, and ultimately may not be able to achieve the goal. However, a person who patronizes and smoothly, he may not even have direction. Therefore, the spirit of advancing bravely must be closely combined with harmony and obedience, which is the fourth group of ancestors to us.",5.0,2017-02-04 22:48:50
22847716,https://ak-d.tripcdn.com/images/fd/headphoto/g3/M08/24/15/CggYGlYd-tqAZHmHAABSjU28YwE333.jpg,muggu,"Tickets are free, there are many trees, and the air is really fresh. There are some people walking, very quiet.",5.0,2016-01-26 10:31:31
