place_id,head_image,user_name,content,user_rating,create_time
78910,https://ak-d.tripcdn.com/images/0a25n224x8tpfa2fb8FBD.jpg,_TI***b1,"beautiful place to visit and the scenery is breathtaking. would suggest renting a hanbok to enter and take a few pictures. entry is free when wearing a hanbok! really nice place as the palace is an ancient architecture that is surrounded by modern office buildings. they have a cafe inside the palace to buy souvenirs/merchandise and drinks. got the hot chocolate drink, it was 3,000 krw and a heated can with paper cups provided. they also have restrooms inside the palace, it was hygienic but troublesome to enter with a hanbok. bought a tote bag and poker card as souvenirs gifts and the packaging was really nice and simple",5.0,2023-12-20 17:49:20
78910,https://ak-d.tripcdn.com/images/1i54d12000dex2bvn9345.jpg,_TI***hc,A wonderful place to relax your mind. Affordable and most important friendly environment,5.0,2024-04-14 13:51:29
78910,https://ak-d.tripcdn.com/images/0a22a224x8tndbot5A353.jpg,Nero2022,An amazing contemporary witness of former times. Very beautifully landscaped gardens and houses.,5.0,2023-12-28 12:05:09
78910,https://ak-d.tripcdn.com/images/0a21l2234dactzozl2DF0.jpg,_TI***2c,it is a really good place to go with your loves ones definitely an enjoyable trip!,5.0,2024-04-15 06:40:46
78910,https://ak-d.tripcdn.com/images/0a23j224x8vhce3ajC741.jpg,Sg_story,it was so nice that I wear hanbok with my friends too &hellip; new year welly spend 💕💕💕,5.0,2024-07-02 18:45:52
78910,https://ak-d.tripcdn.com/images/1i54b12000dex2gdeE7AD.jpg,_TI***dr,"Gyeongbokgung Palace is an absolute must-visit for anyone traveling to Seoul. The changing of the guard ceremony is a highlight and adds a touch of historical grandeur to the visit. The entrance fee is reasonable for the experience, and the location is easily accessible by public transport. I recommend visiting early in the morning to avoid crowds and fully enjoy the peaceful surroundings.",4.0,2024-04-29 11:52:11
78910,https://ak-d.tripcdn.com/images/0a235224x8tx2hjdw3438.jpg,SSK1987,Fantastic grounds and scenery. Well worth the $3 for the audio tour to find out the history of the buildings. Allow at least an hour for a good look. It cam be hot as not much over and some uneven paths so wear good shoes. Definitely worth the visit.,5.0,2024-04-20 03:33:45
78910,https://ak-d.tripcdn.com/images/0Z83c120009c0yqot45B6.jpg,Tonza,"The oldest and most beautiful palace in Korea, the Gyeongboo Palace in Seoul, South Korea, has a history of 600 years and is one of the most spectacular palaces of the Korean period. The interior of Gyeongboo Palace has many exquisite buildings and courtyards to enjoy the traditional Korean court culture and architectural style. Gyeongboo Palace is also a good place to take pictures, whether it is day or night, there are different beauty. I recommend that you rent a set of Hanfu before visiting Gyeongboo Palace, so that you can enter Gyeongboo Palace for free, and take pictures in front of the classical building, it will have a more atmosphere and feeling. I rented a set of Hanfu rental shops in Xihua Hanfu near Gyeongbokgung Palace. The clerk was very enthusiastic and helped me compile and choose accessories. There are many styles of Hanfu, traditional and modern, and you can choose according to your preferences. After entering Gyeongboo Palace, I first saw the Hing Li Gate, which is where the keeper change ceremony was held. The change ceremony is a spectacular and interesting re-enactment of the keeper&#39;s military ceremony in Korea. You can also try on the keeper&#39;s costumes before and after the change ceremony, or take a photo with the keeper. The changing ceremony is several times a day, and it is recommended to check the schedule in advance. Then I visited places such as Qinzheng Palace, Sizheng Palace, Zishan Hall, Qinghui Building, Kangning Palace, Lushan and Xiangyuan Pavilion. Each place has its own characteristics and stories, and you can learn more through audio guides or guided materials. My favorite is the Gyeonggi Building, a building located above the square lake, very beautiful and elegant. There are reflections on the lake, which is perfect for taking pictures. Gyeongboo Palace is one of the must-visit attractions in Seoul. You can not only feel the history and culture of Korea, but also experience the fun of wearing Korean clothes and eating ginseng chicken soup. If you also want to visit Gyeongboo Palace, please remember to plan the time and route in advance, and close the museum every Tuesday.",5.0,2023-07-15 23:36:48
78910,https://ak-d.tripcdn.com/images/1h66b12000frb8mim6EE7.jpg,熊茂祥 MikroTik认证工程师,This is Seoul&#39;s must-see attraction Gyeongboo Palace! Impeccable!,5.0,2024-10-12 19:40:06
78910,https://ak-d.tripcdn.com/images/0a2162234cyhxgsyoCA45.jpg,Natasha Nguyen,"Gyeongbokgung Palace was the main royal palace of the Joseon dynasty. Built in 1395, it is located in northern Seoul.",5.0,2023-12-02 13:21:00
78910,https://ak-d.tripcdn.com/images/0a25m224x8w0vwmi34F3E.jpg,MisterAriff,Beautiful palace! One of the historic landmark in Seoul. Recommended to visit!,5.0,2023-11-30 20:01:52
78910,https://ak-d.tripcdn.com/images/0a22m224x8umt9yrr4455.jpg,RamG,A wonderful and must visit destination..Good place to spend time with family,4.0,2024-04-28 10:09:22
78910,https://ak-d.tripcdn.com/images/0a24o224x8ufzgzem32F9.jpg,Jackal Chung,beautiful traditional palace in Korea must visit!,5.0,2024-05-05 21:03:12
78910,https://ak-d.tripcdn.com/images/0Z81z224x8tm8qs8sD1E1.jpg,kahori,"The night view of Gyeongboo Palace, especially a two-story building in the pond, is particularly beautiful under the lighting, and the real thing is more beautiful than the photos I took. Interested travelers can check in and see",4.0,2024-10-11 19:44:18
78910,https://ak-d.tripcdn.com/images/0a2252215exokya1tEFDE.jpg,Sldn,great place but don&rsquo;t forget to wear hangbuk,5.0,2024-07-05 18:40:34
78910,https://ak-d.tripcdn.com/images/0a24m224x8uhz5a0u013A.jpg,DANNY EZRA LEO,"Nice place and beautiful senory, to go relax",5.0,2024-04-14 04:34:31
78910,https://ak-d.tripcdn.com/images/0a24f2224wjekawts03BE.jpg,JXS,History and moment,5.0,2024-05-27 16:59:11
78910,https://ak-d.tripcdn.com/images/0a24f2224wjekawts03BE.jpg,JXS,History and moment,5.0,2024-05-27 16:59:03
78910,https://ak-d.tripcdn.com/images/0a20b224x8uq8edxr6CE9.jpg,SAQIB_1994,very good and beautifull for enjoyment,5.0,2024-05-08 02:49:48
78910,https://ak-d.tripcdn.com/images/0a26x224x8umfk4oa17E5.jpg,YongKuiiMusic,no need to say this place very beautiful,5.0,2024-04-27 04:29:06
78910,https://ak-d.tripcdn.com/images/0a24j224x8ulthtk6C384.jpg,BeruangKoala,Hectic with people but calm on the view,5.0,2024-04-25 13:55:28
78910,https://ak-d.tripcdn.com/images/0a22c224x8u4a5l57C897.jpg,Nick Leong Leong,This is a good place to travel,5.0,2024-04-27 22:47:42
78910,https://ak-d.tripcdn.com/images/0a26j224x8ukf7kqwA877.jpg,Fiqqq,full with history ❤️ i love it,5.0,2024-04-21 13:01:33
78910,https://ak-d.tripcdn.com/images/1i50h12000dex2cnoF179.jpg,_TI***x8,nice place and good service,5.0,2024-05-07 20:36:58
78910,https://ak-d.tripcdn.com/images/0a2162224r68nnys016FC.jpg,Nabila bell,lovee this placee 🤍🤍🤍🤍,5.0,2024-04-20 03:03:43
78910,https://ak-d.tripcdn.com/images/0a273224x8uiw6rhg7924.jpg,Navin,Reasons to Recommend: good,5.0,2024-04-17 00:01:59
78910,https://ak-d.tripcdn.com/images/1h62t12000d3ok7z53144.jpg,旅行生活体验,"Gyeongboo Palace has a long history and magnificent architecture. Traditional Korean style, solemn and solemn. The main point is the ancient palace architecture and rich cultural display. It is an important place to understand Korean history and culture.",5.0,2024-10-28 21:24:49
78910,https://ak-d.tripcdn.com/images/0a23x2224u2mzgsg14FE8.jpg,mieda razak,Nice and beautiful place,5.0,2024-04-18 23:39:26
78910,https://ak-d.tripcdn.com/images/1i54d12000dex2bvn9345.jpg,_TI***h8,the best place to healing,5.0,2024-04-16 01:52:22
78910,https://ak-d.tripcdn.com/images/1i54d12000dex2bvn9345.jpg,Lone ranger Traveller,very good service &amp; nice,5.0,2024-04-28 07:04:32
78910,https://ak-d.tripcdn.com/images/1i50h12000dex2cnoF179.jpg,Nurzakiah,good place and easy book,5.0,2024-04-26 18:15:02
78910,https://ak-d.tripcdn.com/images/0a21u224x8uhiv78eF519.jpg,Mangatshamsher,good..Business Hours:,5.0,2024-04-12 15:00:35
78910,https://ak-d.tripcdn.com/images/0a210224x8vro6fj00065.jpg,Bobo0692,it was such an incredible experience to visit Gyeongbokgung Palace. It feels like I was transported back to the Royal past the moment I stepped into the space.,5.0,2023-12-04 13:21:15
78910,https://ak-d.tripcdn.com/images/1i55t12000dex1sw610BA.jpg,_TI***wt,nice and ancient place,5.0,2024-05-04 10:36:11
78910,https://ak-d.tripcdn.com/images/0a20e224x8ulnm0bc24CE.jpg,cath teng,good places and relax,5.0,2024-04-24 20:42:41
78910,https://ak-d.tripcdn.com/images/0a26m224x8uo6wqyi585D.jpg,safiq razif,Nice view superNice,5.0,2024-05-01 15:14:31
78910,https://ak-d.tripcdn.com/images/0a2262215e9b8et8jAFDB.jpg,cherrytomato,Gyeongbokgung Palace is definitely a great place for understanding the history of Korea and Hanbok experience!🤩,5.0,2023-12-28 20:16:52
78910,https://ak-d.tripcdn.com/images/0a201224x8upaixlwA708.jpg,Jazziejazz,nice place to visit,5.0,2024-05-04 14:37:42
78910,https://ak-d.tripcdn.com/images/0a22p2234c9u8ip9c8B88.jpg,MS mia,nice place to visit,5.0,2024-05-04 13:44:17
78910,https://ak-d.tripcdn.com/images/0a24d224x8uk2h19i22F7.jpg,Herry Marpi,Historical places,5.0,2024-04-20 10:51:49
78910,https://ak-d.tripcdn.com/images/0a21o2215gdh1dsr44D9F.jpg,Simn,niceee vieww,5.0,2024-04-30 12:31:26
10524255,https://ak-d.tripcdn.com/images/1i50h12000dex2cnoF179.jpg,Zhuo Lin Chong,"This place is overrated and the stalls overcharged for food. But restaurants offer some good food at reasonable prices. As for shopping, it is the best place to be in the whole of Korea. The shops here often have products/deals that are absent from the rest of the branches, and often provide instant tax rebate. They come with long queues though.",4.0,2024-11-05 15:55:30
10524255,https://ak-d.tripcdn.com/images/0a20522349s8j4aqoD653.jpg,PeaceBeUponUs,"Myeongdong is a lively destination, be it day or night, tourists and locals flocked here to experience the best of Seoul. Typically, people come not only to shop or eat but also to immerse themselves in the vibrant energy and iconic Korean atmosphere that fills the streets.",5.0,2024-10-31 17:44:36
10524255,https://ak-d.tripcdn.com/images/0a25g224x8x4xjo3h3487.jpg,Eanglin,"good for shopping and eating! they have so many street foods and popular food store!! delicious!! and you can buy everything at there, very convenience and interesting place",5.0,2024-10-25 18:31:42
10524255,https://ak-d.tripcdn.com/images/fd/headphoto/g4/M02/B1/21/CggYHVa9lvqAUyUSAABFUanE-C0302.jpg,LASTOX,"Spicy fried rice cake, very Korean. Myeongdong must eat, not fried, healthier.",4.0,2024-08-19 00:38:30
10524255,https://ak-d.tripcdn.com/images/1i54d12000dex2bvn9345.jpg,M74***24,"Going to the ticket office, a conductor was shouting, let the travel agency QR code scan will be discounted by 25%, and then after scanning, I found that the mobile phone directly linked to the Trip.com website, and then paid directly online.",5.0,2024-05-09 23:21:15
10524255,https://ak-d.tripcdn.com/images/1h64m12000bs15oix887A.jpg,孙广梅,"Myeongdong Food Street is very lively at night, there are a variety of snacks, there are sweet, spicy, fish balls, fresh shrimp slip, and cute small fish desserts of various flavors. Children like it very much. 👍",5.0,2024-03-20 14:17:40
10524255,https://ak-d.tripcdn.com/images/fd/headphoto/g2/M09/71/B8/CghzgFUl4AKAWAtDAAD5SJ4bF6Y115.jpg,无心999,"Trip.com It is very convenient to buy tickets on the QR code to exchange tickets, and there is a special ticket exchange channel! The most beautiful scenery is in the bathroom, and it is recommended that friends who go to the bathroom must not miss it. Remember to punch in for food and couple locks under Nanshan Tower!",5.0,2024-06-19 21:50:49
10524255,https://ak-d.tripcdn.com/images/1i55a12000dex2inkB7FE.jpg,102***62,"I made a little strategy before I traveled, and I felt that I had to see the random show, so I booked the random show in the afternoon on the first day. It was really good and felt very good. The performance was an hour and a half, and I didn&rsquo;t feel bored. It can be seen that this theme is single and there are not many stories. How interesting the show without lines was performed by the actors. It was just that the location of the theater was a bit difficult to find. The location displayed when buying tickets was still with the UNESCO office, and it didn&#39;t occur to me that it was so difficult to find. UNESCO is very low-key. The program is recommended. However, there are many vacancies, but we are arranged in the last row, I don&#39;t know what this row is about, the performance is very good. Worth a look.",5.0,2024-02-17 20:50:34
10524255,https://ak-d.tripcdn.com/images/fd/headphoto/g2/M0B/B3/C1/Cghzf1Vl7X6ALYKiAADukjMyqIc342.jpg,Ron,Large margin of preference,5.0,2024-07-11 21:01:53
10524255,https://ak-d.tripcdn.com/images/1i53212000dex236aF023.jpg,tanlam22,"The place in the Korean drama finally came, love lock, Nanshan Tower! The bus is very convenient, and the toilet on the tower is all glass, the thief is interesting! Panoramic toilet nb! Trip.com It seems that there is a little discount compared to buying tickets on the spot, not bad.",4.0,2024-03-09 09:43:06
10524255,https://ak-d.tripcdn.com/images/0Z86812000d9ia11l7D6D.jpg,西城_姐姐,"To Seoul, you must go to Nanshan Tower.",5.0,2024-03-13 13:24:18
10524255,https://ak-d.tripcdn.com/images/1i50h12000dex2cnoF179.jpg,M52***10,"Ticket prices are a bit expensive, many tourists, the environment is good, but there are many stairs, but the conductor knows Mandarin and appreciates it very much.",5.0,2024-04-11 12:53:32
10524255,https://ak-d.tripcdn.com/images/1i52g12000dex1hwn04E3.jpg,E03***24,"It is worth seeing a night view more beautiful. I have been to the third time. Every time I go to Korea, I have friends to accompany me.",5.0,2024-05-25 08:21:51
10524255,https://ak-d.tripcdn.com/images/1mi6o12000b5md1d77B69.png,Anonymous User,"The scenery is very good, especially the sunset and night view. Overlooking Seoul, just the glass is easy to reflect.",4.0,2024-03-04 20:23:31
10524255,https://ak-d.tripcdn.com/images/1h60v224x8tp2tv4yFADE.jpg,汶华淼淼,I don&rsquo;t feel a little regretful because I came and I regret double when I went up.,3.0,2024-06-26 19:02:48
10524255,https://ak-d.tripcdn.com/images/1mi6o12000b5md1d77B69.png,Anonymous User,The travel experience is very good!,5.0,2024-05-25 18:51:20
10524255,https://ak-d.tripcdn.com/images/1h65912000db0922a74A4.jpg,Tang.勤,Service attitude is very good,5.0,2024-05-15 09:29:49
10524255,https://ak-d.tripcdn.com/images/1mi6o12000b5md1d77B69.png,Anonymous User,"Very good, very satisfied",5.0,2024-08-26 14:39:11
10524255,https://ak-d.tripcdn.com/images/1mi6o12000b5md1d77B69.png,Anonymous User,"Not bad, it is snowing and the view is not good.",5.0,2024-02-25 21:34:25
10524255,https://ak-d.tripcdn.com/images/0a2102224x9vrlka834D5.jpg,Ceres Ng,"We have been coming over to Yoogane 3 times for our 5-day trip. service is ok, but the food and price point is good. it is especially nice during such cold season.come and try it out.do note that the food order has to be based on the number of pax. if total 4 adults, have to order 4 pax worth of food. my teen boy is considered an adult.",5.0,2023-11-29 21:20:22
10524255,https://ak-d.tripcdn.com/images/1mi6o12000b5md1d77B69.png,Anonymous User,Stunning ～ Shock ～ My smile will never disappear ～ Korea&#39;s entertainment industry is really developed!,5.0,2024-02-01 18:51:18
10524255,https://ak-d.tripcdn.com/images/0Z83q12000d9g5fwe682C.jpg,菜菜的后花园,"The most lively place in Seoul is also the city center. There are several big shopping malls and duty-free shops. It is a good place for those who buy and sweep goods. I went to the new world. Basically, they are all Chinese. The guide is also Chinese. Communication is barrier-free. The purchase will buy a lot of things. There is also a Catholic church, not big, you can see.",4.0,2022-07-21 23:02:15
10524255,https://ak-d.tripcdn.com/images/1mi6o12000b5md1d77B69.png,Anonymous User,"The kids love it,",5.0,2024-02-17 02:13:26
10524255,https://ak-d.tripcdn.com/images/0a22i224x8x1wl10s4642.jpg,SeaMonster,"Myeong-dong is a vibrant and bustling shopping district in Seoul, South Korea, that offers an incredible blend of fashion, beauty, and food experiences. It&rsquo;s known for its streets lined with a wide range of shops, from high-end international brands to affordable local boutiques, making it a haven for fashion enthusiasts. For beauty lovers, the area is packed with Korean skincare and cosmetics shops offering high-quality products at competitive prices, often with generous samples.One of the hig",5.0,2024-10-19 18:39:02
10524255,https://ak-d.tripcdn.com/images/0a2162234cyhxgsyoCA45.jpg,Natasha Nguyen,"Bustling Myeong-dong is a shopping area packed with international fashion brands, luxury department stores and homegrown cosmetics shops",5.0,2023-12-02 13:18:10
10524255,https://ak-d.tripcdn.com/images/1mi6o12000b5md1d77B69.png,Anonymous User,"Very good, Trip.com easy to pick up tickets",5.0,2024-03-06 10:31:11
10524255,https://ak-d.tripcdn.com/images/0a228424x8x1qsky59E32.jpg,Sasha_aa,"The most famous street in Korea. Come here in the evening and try all kinds of street food. Also here you can find all the flagship stores from Korean cosmetics to clothes and shoes. The atmosphere of celebration, crowd and fun is always here.",4.0,2024-10-20 21:11:56
10524255,https://ak-d.tripcdn.com/images/0a20h224x8tjy1892C222.jpg,Displaynameakreadytaken,"one thing that should be brought up more often when talking about Myeong-dong is how accessible the place is. Myeong-dong has earned its reputation as one of the most popular, if not THE most popular tourist destination in Seoul for a reason.",5.0,2023-12-28 11:31:10
10524255,https://ak-d.tripcdn.com/images/1h62t12000d3ok7z53144.jpg,旅行生活体验,Myeongdong is lively and prosperous with business. There are many shops and many foods. The main point is the fashionable shopping atmosphere and various specialty snacks. It is a paradise for shopping and food lovers.,5.0,2024-10-28 21:25:19
10524255,https://ak-d.tripcdn.com/images/1i54d12000dex2bvn9345.jpg,M26***88,"The fog saw nothing, no one reminded me before I went up",3.0,2024-07-12 09:41:06
10524255,https://ak-d.tripcdn.com/images/0a25e2215h38sd1ww19D1.jpg,MuhammadKhan,"It was an amazing experience, loved it.",5.0,2024-01-23 17:57:48
10524255,https://ak-d.tripcdn.com/images/1mi6o12000b5md1d77B69.png,Anonymous User,"The entrance projection hall is rich in animation and suitable for taking pictures. Although the floor is not very high, the scenery in winter is beautiful.",4.0,2023-12-25 14:26:39
10524255,https://ak-d.tripcdn.com/images/0a26c22348tzfly4w081F.jpg,Heyna,"The busiest lively street in Seoul, you can enjoy many types of local street food and korean souvenirs to bring back home, If you are looking for skincare products then myeong-dong is the right place to go. its definitely worth a visit with lot of things to find and buy ☺️",5.0,2024-10-14 03:40:30
10524255,https://ak-d.tripcdn.com/images/0a26u2234az4wun8g9E5F.jpg,RS8700,This new bagel cafe at Myeong-dong Stanford hotel is wonderful place to hang out! Food and drinks were excellent.The price was reasonable all the staff super friendly😀atmosphere so great. Lots of seating space and have breakfast special check it out guys ⭐️⭐️⭐️⭐️,5.0,2023-12-23 21:53:21
10524255,https://ak-d.tripcdn.com/images/0a20n2215f0m70umaBE04.jpg,ひかりん,"Korea Recommended Yakiniku 🐖&hearts;️ Hanam Pork House Myeongdong No. 1 Branch 🇰🇷🐖🚩 Otoji-ro 2-ga, Jung-gu, Seoul 199-77 (199-77, Eulji-ro 2-ga, Jung-gu, Seoul) Arrived and ordered the first meal of rice platter menu. Raw Samgyeopsal, Garlic and kimchi are baked in raw ribs and wrapped in sesame leaves to eat 🐖&hearts;️ If you eat in Myeongdong, is this the place? I think it&#39;s a chain store in a place like Dongdaemun 々, so if you find it, please go and see it ❗ #Hanam Pig House #Korea #Korea Travel #Seoul #Seoul Travel #Korea Information #Seoul Sightseeing #Korean Guru Me #Korean gourmet trip #Seoul gourmet #Seoul gourmet trip #Korean rice #Korean rice #Korean food",5.0,2023-05-28 11:58:49
10524255,https://ak-d.tripcdn.com/images/fd/headphoto/g3/M00/1A/AB/CggYGlXJ0liATi4tAAAnKm8RdYc792.jpg,MrKlose,"The ticket office is a Chinese-speaking Korean lady, hahaha is very cute. Make a card at the landmark of Seoul Tower, the stay is not long",5.0,2024-01-10 15:28:41
10524255,https://ak-d.tripcdn.com/images/0Z859224x8u1lvcr599FF.jpg,漂亮的王小姐和帅气的李先生,Still OK,4.0,2024-04-04 17:39:57
10524255,https://ak-d.tripcdn.com/images/1i55a12000dex2inkB7FE.jpg,727***08,The driver is very friendly and the service is good. Introduce the scenery along the way. Introduction to culture,5.0,2024-01-13 07:54:30
10524255,https://ak-d.tripcdn.com/images/0a24o224x8tpxb3ck953B.jpg,MJkang,"Myeongdong is a vibrant shopping district in Seoul, known for its bustling atmosphere and diverse offerings. Visitors can explore a myriad of shops, ranging from high-end fashion brands to unique street vendors selling trendy accessories and cosmetics. The area is also famous for its delicious street food, with tempting options like tteokbokki (spicy rice cakes), hotteok (sweet pancakes), and fried chicken.",4.0,2024-10-09 21:36:12
10524255,https://ak-d.tripcdn.com/images/1i54b12000dex2gdeE7AD.jpg,朗根布兰德朱鸡石,,5.0,2023-11-16 08:23:23
10524255,https://ak-d.tripcdn.com/images/0Z81112000cg1byedD3CB.jpg,尊贵的王一博老婆,"Very favorable, the view is very good, the service is very good.",5.0,2024-01-15 19:34:12
10524255,https://ak-d.tripcdn.com/images/1i55t12000dex1sw610BA.jpg,M60***73,Tashan overlooks the whole of Seoul. The night view is beautiful.,5.0,2024-01-16 16:46:22
10524255,https://ak-d.tripcdn.com/images/headphoto/968/552/572/7c84f7e56c7144f4abfce343e0e4f2ef.jpg,JohnnyStep,"Very convenient, Seoul is still beautiful and romantic",5.0,2023-12-30 00:26:55
10524255,https://ak-d.tripcdn.com/images/1i54b12000dex2gdeE7AD.jpg,M31***74,"Very good, worth going",5.0,2024-02-04 20:01:55
10524255,https://ak-d.tripcdn.com/images/0a24r2234anea5qhs2850.jpg,AL2033,位於明洞第一街「進士宅」傳統韓式會席定食套餐，午餐晚餐菜單相同，裝修及味道恰意，定食由四萬至十二萬一位不等，值得一試及打咭留念呢!註：google map 可以找到位置，留意小巷入,5.0,2023-05-23 22:12:45
10524255,https://ak-d.tripcdn.com/images/1i55t12000dex1sw610BA.jpg,M60***73,It&#39;s good to go shopping here,5.0,2024-01-16 16:46:43
10524255,https://ak-d.tripcdn.com/images/0a2712224uofy9ynk6A20.jpg,a2cfuji,"When you go to Myeongdong, you will be overwhelmed by the size of the shopping street. There are many food stalls, shops, and clothing miscellaneous goods shops. No matter what you eat, there is no loss. It&#39;s really the best city. The exchange rate here is better than the airport.",5.0,2023-05-26 11:59:46
10524255,https://ak-d.tripcdn.com/images/0a20t22348yfu0gog6BF3.jpg,E38***56,"A bustling place in the evening where trendy music could be heard from shops to shops. Lots of variety of food stalls, cafe, souvenirs stalls, fashion, cosmetics etc to shop for. Also a fair bit of branded products as well. Never get tired of coming here!",5.0,2023-05-30 22:01:41
10524255,https://ak-d.tripcdn.com/images/0a25w4234chr5vyn42280.jpg,Winggy,"shopping and street food, amazing for families. the inexpensive delicious street food is a must try and is on the high street every night till around 10.30pm.",5.0,2023-09-10 17:42:06
10524255,https://ak-d.tripcdn.com/images/0a25x2215fs9p7bhe1E85.jpg,Annahyuk,"After the epidemic, the lively feeling finally resumed. There are more types of food stalls. There are many types. Whether it is fried rice cakes, grilled lobster chicken cakes, fish cake soup, barbecue, sugar gourd cakes, all Korean snacks are really eaten! There are also many money exchange places. It is really very convenient. There are Lotte Duty Free Shop and Department Stores nearby. You can buy everything.",5.0,2023-04-12 12:44:16
10524255,https://ak-d.tripcdn.com/images/0a23n2215dw7ve93kBE44.jpg,khsr02,"I went to Myeongdong, a famous tourist spot! Due to the influence of Corona, there were almost no people for a while, and the shops closed one after another, but now the vibrancy is almost back! There were many specialty stalls lined up ✨ There are still a few tenants who are still vacant, but I think you can enjoy shopping enough. There were many Japanese tourists, so it is recommended for those who cannot speak Korean!",5.0,2023-02-02 21:26:17
10524255,https://ak-d.tripcdn.com/images/0a21u22345ohmf1jlD54E.jpg,massu,"I found a cafe near Myeongdong where Roti Boy can eat 10 years ago! It&#39;s great to be able to eat the feeling that the outside is crispy and the butter is juwa inside ♪ It&#39;s a pity that it&#39;s closed on Saturdays and Sundays, but it&#39;s a cafe that I&#39;m doing early in the morning!",5.0,2023-01-21 01:43:32
10524255,https://ak-d.tripcdn.com/images/0a2712224sceskgtdA056.jpg,Nichani,"A lot of restaurants Shopping is satisfying. There are all brands, there are many people. If you want to sit in a coffee shop, it&#39;s full. have to stand to eat on the roadside",5.0,2023-02-12 22:01:45
