place_id,head_image,user_name,content,user_rating,create_time
81858,https://ak-d.tripcdn.com/images/Z80u090000004aref0D73.jpg,我爱条条妈,"Qingxi Palace is definitely worth visiting. But the preparation is also very strict, not big, but it has a distinctive feeling, here are all square.",4.0,2016-11-06 17:20:28
81858,https://ak-d.tripcdn.com/images/t1/headphoto/235/784/767/6f520eddf9e248a7ad45805709367fca.jpg,我有一只小毛驴丶我一直都在骑,"Tourists are not very many. As a royal palace building, it&#39;s still very magnificent here. It&#39;s very fond of the antique style. Weapons don&#39;t charge admission tickets.",4.0,2016-07-07 13:49:46
81858,https://ak-d.tripcdn.com/images/1i54b12000dex2gdeE7AD.jpg,M26***73,"The Qingxi Palace was built by the 15th King of Korea, Kwang Haijun. It was built in 1623 to leave the palace. There are many unique buildings in the palace. Look at it.",4.0,2016-03-19 11:29:37
81858,https://ak-d.tripcdn.com/images/fd/headphoto/g1/M07/54/55/CghzflSfhLCAOvDQAAGShveLnys000.jpg,hlppool,,4.0,2014-07-04 23:13:43
81858,https://ak-d.tripcdn.com/images/1i50112000dex2eb2B282.jpg,约德尔悍将,"Qingxi Palace, an ancient and solemn palace, the palace construction is really brilliant, the color matching is also very good, very ancient architectural sense of age.",4.0,2016-08-14 12:16:36
81858,https://ak-d.tripcdn.com/images/fd/headphoto/g2/M06/6F/17/CghzgFVfdJuAII0lAAAeL5alrpM914.jpg,YangtzeRiver,"Metro Line 5 can be easily accessed. It used to be huge, but now it has retained part of it. Chongzhengdian Hall has become an important historical and cultural place.",4.0,2015-08-06 23:18:42
81858,https://ak-d.tripcdn.com/images/headphoto/822/182/169/fddcfaf8b58242ee959907fe90524548.jpg,芥末丶丶,It&#39;s a pity that you can&#39;t go inside and only browse the outside. It would be much better if we could go in and visit it. It would be a commercial resort for parents and children.,4.0,2016-10-29 17:33:43
81858,https://ak-d.tripcdn.com/images/fd/headphoto/g1/M0A/A8/B2/CghzfVTNvQGAAf7dAAT8l3jlABs349.jpg,娑娜,"It was supposed to be very interesting, but when I went, I felt rather desolate, so I didn&#39;t think much of it. Ordinary palace. Quiet, not many tourists.",4.0,2016-10-30 18:26:18
81858,https://ak-d.tripcdn.com/images/headphoto/719/009/748/66e6a94e6e844f5e82b8706f5f86d7bd.jpg,努努nunu,"Gyeonggi is the place where their royal family lived in the past, just at No. 1, Xinmen Road, Zhonglu District, Seoul, although not big, but fully equipped",4.0,2016-07-24 16:26:51
81858,https://ak-d.tripcdn.com/images/Z807060000001niqnB809.jpg,白金刘老五,"Understanding local history is a good place to go, there are a lot of things to see and see, catch up with the good weather, can shoot good works.",4.0,2016-08-18 12:27:06
81858,https://ak-d.tripcdn.com/images/fd/headphoto/g1/M06/74/60/CghzflTUFL2ACsrZAAAk7u3bgDM211.jpg,流浪者帕吉屮,"Also an ancient palace, very historic, unique style, good place to take pictures, and free tickets, it is recommended",4.0,2016-07-09 14:24:08
81858,https://ak-d.tripcdn.com/images/fd/headphoto/g2/M01/98/A4/CghzgFTUQIuAWkjEAAArVZf8GsU953.jpg,玛利亚安东尼,"The Qingxi Palace is far from the magnificent and luxurious imagined, but it is simple and the environment is particularly good, but the preparation is also very strict.",4.0,2016-08-21 11:39:30
81858,https://ak-d.tripcdn.com/images/1i54412000dex20ub5452.jpg,M21***56,"The Qingxi Palace, also known as the West Palace, is located on the west side of Jingfu Palace, but compared to the Jingfu Palace, there are few tourists and a quiet place.",4.0,2016-05-10 12:04:15
81858,https://ak-d.tripcdn.com/images/t1/headphoto/918/340/810/bfb3d20f19a244438f2abddb58bc6286.jpg,雨菲依然,"A very old palace, when it rained, everyone was very unhappy, the tour guide did not introduce much, it was boring.",4.0,2015-09-21 20:01:54
81858,https://ak-d.tripcdn.com/images/fd/headphoto/g2/M07/8B/F6/CghzgFU9wHOAa18nAAAfR8x1pxI046.jpg,来自未来的伞兵,"The Qingxi Palace is really brilliant, the color matching is also very good, understanding the local history is a good place to go",4.0,2016-08-20 19:57:47
81858,https://ak-d.tripcdn.com/images/t1/headphoto/887/188/680/3f1a5a910acb43d390cf389a2d29e57a.jpg,糊你熊脸芭蕉桑,,4.0,2016-08-15 18:58:49
81858,https://ak-d.tripcdn.com/images/fd/headphoto/g1/M09/57/41/CghzflU8jNmAcLAZAAArqkroPqg758.jpg,沈亮s,,4.0,2016-09-02 16:33:22
81858,https://ak-d.tripcdn.com/images/1i55a12000dex2inkB7FE.jpg,风情万种7哥哥,,4.0,2016-07-27 19:47:21
81858,https://ak-d.tripcdn.com/images/fd/headphoto/g2/M06/A7/58/Cghzf1TNhymACiLSAAAW9lRhNzM192.jpg,孙宁god,,4.0,2016-07-08 13:29:22
81858,https://ak-d.tripcdn.com/images/t1/headphoto/837/441/973/357d7892280343238a3ccfe0fc174a71.jpg,壮士哪里去,,4.0,2016-11-26 17:15:28
81858,https://ak-d.tripcdn.com/images/fd/headphoto/g2/M05/7A/0C/CghzgFTS0syABVwkAAAlJANILq0105.jpg,敬仨,,4.0,2016-09-04 11:54:12
81858,https://ak-d.tripcdn.com/images/1i50112000dex2eb2B282.jpg,575231000,,4.0,2015-09-18 22:29:41
81858,https://ak-d.tripcdn.com/images/1i54412000dex20ub5452.jpg,哞哞724,,3.0,2015-11-17 00:23:02
81858,https://ak-d.tripcdn.com/images/headphoto/424/805/675/4c578621f1404b469bc41ab79bc45e7d.jpg,咔sa丶叮叮屮,,4.0,2016-09-04 20:55:00
81858,https://ak-d.tripcdn.com/images/fd/headphoto/g5/M00/4F/0C/CggYr1cyulyAFjFUAAZsMJBR2H0368.jpg,ccoocc,,4.0,2016-04-12 18:59:57
81858,https://ak-d.tripcdn.com/images/0Z84j120008wnpu0s9952.jpg,jennynui,"A gate with many palaces, buildings, and many doors, but it is blocked and cannot be seen.",3.0,2014-03-10 17:38:38
81858,https://ak-d.tripcdn.com/images/Z80v0d0000006wou903F0.jpg,狂歌天下2,"I didn&#39;t feel too good, maybe I didn&#39;t feel anything else after seeing the Forbidden City.",4.0,2017-09-08 10:07:30
81858,,,Old and Modern togheter!,5.0,2013-04-11 19:33:21
81858,https://ak-d.tripcdn.com/images/1i55a12000dex2inkB7FE.jpg,煊煊煊煊,"Located in the west of Seoul, it is the late North Korean palace, also known as Xiyu.",4.0,2019-01-10 00:21:00
81858,,,"Its a really beautiful place, but when i went which was at 2017, August some places were off limits like a small castle-like building that is surrounded by a lake and is connected by a small bridge, and so i wish i was able to fully see the castle.",4.0,2017-08-19 19:39:07
