place_id,place_name,comm_score,cover_image_url,location,tag_list,coordinate_type,latitude,longitude,address,description
18700188,YG Entertainment,4.8,https://ak-d.tripcdn.com/images/10021f000001gxe6zD466.jpg,Seoul,['Modern Architecture'],GCJ02,37.548857,126.907828,"7 Huiujeong-ro 1-gil, Mapo-gu, Seoul, South Korea","YG Entertainment is one of the largest entertainment brokerage companies in Korea and the entertainment company with many HipHop singers in Korea. It was founded in 1996 by Yang Hyun Suk, one of the members of the disbanded 90s popular group ""Seo Taiji and the Children"". . As of 2017, its representative artists include PSY (Uncle Bird), BIGBANG, 2NE1, WINNER, EpikHigh, iKON, BLACKPINK, Crystal Boy, Lee Jong Suk, Goo Hye Sun, Lee Ha Yi, Music Tong Musician, Nam Joo Hyuk, Lee Sung Kyung, etc. ."
136469953,Lotte World Adventure,4.6,https://ak-d.tripcdn.com/images/1lo6m12000f15y1q531F0.jpg,Seoul,['Theme Parks'],GCJ02,37.511116,127.098167,"240 Olympic-ro, Songpa-gu, Seoul","A space full of fun 365 days!""Adventure""where you can enjoy regardless of weather.""Magic Island"" where you can enjoy for seasons.It's always a new and enjoyable experience.""Content Heaven"", MZ Generation's customized school uniform experience and photo spot.""Festivals"", full of distinctive seasonal parades""Attractions"" 50 rides that can be enjoyed with all ages.UNIQUE VENUEIn a special space, a new experience!Through various media areas and Garden Stage without worrying about the weather"
24649442,Dongdaemun History & Culture Park,4.6,https://ak-d.tripcdn.com/images/100e11000000r0t51D670.jpg,Seoul,['City Parks'],GCJ02,37.565682,127.008953,"Seoul, South Korea","Dongdaemun History and Culture Park is a complex cultural space that perfectly combines traditional buildings, relics, relics and cutting-edge modern facilities. It is located in Dongdaemun, known as the fashion vane of Korea. It is open to the public 24 hours a day, and the exhibition halls and parks in the park are all free. In fact, Dongdaemun History and Culture Park is a general term for an entire area. It is a collective name for facilities such as Seoul Fortress, Erjian Water Gate, Dongdaemun History Museum, Dongdaemun Relic Exhibition Hall, Dongdaemun Stadium Memorial Hall, Event Hall, and Design Gallery. In order to commemorate the Dongdaemun Stadium, the two lighting towers and the holy fire platform that were used in the night competition have been preserved here. At present, it is not only a theme park where you can learn about the history and culture of Seoul, but also a modern exhibition hall with both design and cultural heritage. It is also a good place for Seoul citizens to relax and entertain."
148880350,"Charlie Puth Concert 2024 Seoul | Charlie Puth Presents ""Something New"" in Seoul",0.0,https://ak-d.tripcdn.com/images/0101g12000d4uowkfB269.jpg,Seoul,['Concerts'],GCJ02,37.4989,126.8671,"430 Gyeongin-ro, Guro District, Seoul, South Korea",No Description
39051446,Love Lock Wall of N Seoul Tower,4.7,https://ak-d.tripcdn.com/images/100b0x000000l9bigAF79.jpg,Seoul,['Nighttime sightseeing'],GCJ02,37.551169,126.988227,"Namsan, Yongsan-gu, Seoul","N Seoul Tower Love Lock Wall is located on the platform of Seoul Tower, where many Korean dramas were filmed. The love lock wall here also attracts many young couples to check in. The full love locks make the place full of happiness, and the colorful locks make up a beautiful scene. Standing on the platform, you can also have a panoramic view of Seoul and feel the romantic atmosphere here."
149276288,2024 P1Harmony FAN MEETING［P1uspace H：CHAMP1ON들의 OLYMP1ece］,0.0,https://ak-d.tripcdn.com/images/0104k12000dx1oh1m0B08.jpg,Seoul,['Concerts'],GCJ02,37.58875,127.032374,Korea University Hwajeong Tiger Dome,No Description
55188156,SBS MTV-THE SHOW,4.5,https://ak-d.tripcdn.com/images/1001170000011j14t6822.jpg,Seoul,"['Featured performance', 'Live Show']",GCJ02,37.5797,126.892684,"SBS Prism Tower, 82 Sangamsan-ro, Mapo-gu, Seoul","It is broadcast live on SBSMTV every Tuesday, visit the TOUR and apply to come to Luo. If you want to see the wonderful performance of K-POPIDOLS on the stage with your own eyes, apply now. At the scene, you can see more than ten groups of performance groups, and you can also see the director's live broadcast technology."
23868316,Hongdae Free Market,4.5,https://ak-d.tripcdn.com/images/fd/tg/g6/M02/3F/C9/CggYtFb-LvGARZozACx2cHixzfk469.jpg,Seoul,['Markets'],GCJ02,37.552301,126.923311,"19-3 Wausan-ro 21-gil, Mapo-gu, Seoul, South Korea","Hongdae Free Market is located in a children's park near Hongik University. Dozens of stalls gather here every weekend. It is a well-known flea market in Seoul. Young Korean artists display and sell their works here, and it is also a treasure place for citizens to find unique and creative daily necessities and gadgets. From hand-made diaries, fun dolls to cute hair accessories and more, it is full of fashionable design elements. It is a creative market that should not be missed when shopping near Hongdae on weekends. In addition, in the park, there are often wonderful impromptu street performances."
149291187,Best of Fujii Kaze 2020-2024 ASIA TOUR in SEOUL,0.0,https://ak-d.tripcdn.com/images/0105f12000g9tzgcx217F.jpg,Seoul,['Concerts'],GCJ02,37.498931,126.867087,Gocheok Sky Dome,No Description
