place_id,head_image,user_name,content,user_rating,create_time
55838981,https://ak-d.tripcdn.com/images/0a21e2215cssg87ht88D3.jpg,Salllyyy,It is comfortable and clean and convenient. I think anyone of all ages can visit!,5.0,2022-12-05 01:04:56
95997528,https://ak-d.tripcdn.com/images/a20j0n000000dzwat48BE.jpg,짜요짜요,Neighbourhood Park,5.0,2023-04-06 04:50:45
61185274,https://ak-d.tripcdn.com/images/0a22i22349qwuugm8C20C.jpg,กินลม ชมวิว,"Going in summer is very beautiful. The air is clear, cool, very refreshing.",5.0,2023-01-09 00:06:54
61185274,https://ak-d.tripcdn.com/images/0a2502215c3kh562o77BD.jpg,설희짱,There is also a valley near Seoul and it is worth visiting.,4.0,2022-08-30 07:45:05
61185274,https://ak-d.tripcdn.com/images/0a22t22345n66gf0w5910.jpg,김문형,"Dobongsan is near my house, so I go every weekend.",5.0,2022-05-01 22:35:34
61185274,https://ak-d.tripcdn.com/images/0a20k22159spluk2o0FBE.jpg,programmer,A place I often go to for a mountaineering course. There are a lot of food and it is easy to go from the bus terminal.,4.0,2022-01-29 21:02:36
61185274,https://ak-d.tripcdn.com/images/Z80412000000s9tge1BDB.jpg,coo***an,"Daofeng Mountain is a great suburban mountain scenery! The magnificent and vast mountains are far and boundless and the beauty is awesome! It is worth seeing, the feeling of infinite scenery in the dangerous peak, the scenery is beautiful all the way, it is worth taking pictures!",5.0,2019-10-10 23:18:09
61185274,https://ak-d.tripcdn.com/images/Z80v0b0000005oflx4C3F.jpg,AURURA木木,"Tickets are not expensive, although not high, but the air quality is very good.",5.0,2018-05-30 01:18:52
