place_id,head_image,user_name,content,user_rating,create_time
65179231,https://ak-d.tripcdn.com/images/0a24e2215cbi7k628E9F5.jpg,zavir,Seolbong Park is located in the suburbs of Icheon city in South Korea. It is one of the most visted places in the city for spending a good weekend.,5.0,2022-09-27 14:46:14
65179231,https://ak-d.tripcdn.com/images/1i54d12000dex2bvn9345.jpg,Rudy Garon,the best ever.,5.0,2024-10-22 20:04:12
65179231,https://ak-d.tripcdn.com/images/1i55t12000dex1sw610BA.jpg,_TX***7f,"The attractions for free admission, although nothing special, can be seen that the Lichuan government has used a lot of effort to maintain the park cleanliness, but often in order to facilitate its own cleaning, after a few years, the cherry blossoms and ginkgo are over-pruned, resulting in the whole beauty is barren. This self-interest of the dumplings made it really beautiful at the time. Except for the spring cherry blossoms, the summer water dance, the autumn maple leaves, ginkgo, the winter iced lake, it is worth admiring.",5.0,2023-01-14 04:40:32
65179231,https://ak-d.tripcdn.com/images/0a24e2215cbi7k628E9F5.jpg,zavir,Seolbong Park is located in the vicinity of Icheon City of South Korea. It is a lovely place with alot of calmness and serenity. Once can come here spend a relaxing day with family or friends. Even school kids can also come here as part of picnic activity.,4.0,2022-09-27 14:43:46
65179231,https://ak-d.tripcdn.com/images/0a25n22349b4gmsu8FB34.jpg,쪼꼬다마,"The place where the Seolbong Park Ceramics Festival was held, which is good for exercise!",5.0,2022-11-26 00:35:13
65179231,https://ak-d.tripcdn.com/images/0a25k22348x96g4359179.jpg,나나옹,"It&#39;s so good to take a walk because there are a lot of fortress days 😉 Music Fountain is also operated, so check the time and visit it~",5.0,2023-09-15 21:05:50
