place_id,head_image,user_name,content,user_rating,create_time
22846435,https://ak-d.tripcdn.com/images/1i52g12000dex1hwn04E3.jpg,艾李李,"Samsung Publication Museum is a very good venue, there are a lot of Samsung publications inside the venue, including some audio materials can also be found, the museum&#39;s interior decoration is very rich.",5.0,2016-01-12 12:26:23
22846435,https://ak-d.tripcdn.com/images/1i54412000dex20ub5452.jpg,遇见值得怀念,Time to visit this publishing museum.,5.0,2020-12-01 14:47:09
22846435,https://ak-d.tripcdn.com/images/Z80f090000003v4slED8E.jpg,JOY7799,"Samsung Publication Museum, which displays a lot of publications, especially some audio-visual works.",5.0,2016-12-20 23:05:47
22846435,https://ak-d.tripcdn.com/images/1i52g12000dex1hwn04E3.jpg,艾思文,"Samsung Publications Museum has a lot of publications to enjoy, this venue is surrounded by large facilities, publications are concentrated here, Samsung is also a famous company.",4.0,2016-05-12 17:28:42
22846435,https://ak-d.tripcdn.com/images/1i54412000dex20ub5452.jpg,_NE***24,"Samsung Publishing Museum is a very good venue, Samsung Publishing Museum belongs to Samsung Group, is a free place to visit, here many original works.",4.0,2016-05-10 14:25:22
22846435,https://ak-d.tripcdn.com/images/t1/headphoto/651/990/790/2d73b27832da408db2862d937a468fbf.jpg,E35***63,"The decoration is magnificent, Samsung company, the largest company in Korea, it must be very rich.",4.0,2016-04-27 14:09:33
61830695,https://ak-d.tripcdn.com/images/0a22m2224qpb31yq881DF.jpg,니키트립,Pildong Street Museum in Jung-gu - Museum to enjoy walking,5.0,2022-04-16 09:51:55
