place_id,head_image,user_name,content,user_rating,create_time
95997329,https://ak-d.tripcdn.com/images/0Z829120008lmmbrg58B1.jpg,吉季,"Yes, a place worth going, like it, go again next time.",5.0,2023-04-30 23:14:32
95997329,https://ak-d.tripcdn.com/images/0a21c2215cicgzh40CED8.jpg,HI__LM,It&#39;s good to play in the park.,5.0,2023-03-02 09:22:07
55871624,https://ak-d.tripcdn.com/images/Z80e0e000000733v10CB3.jpg,Princesstt,"Now similar pet owners are the theme, the cafe has also opened a lot of 1 in China, and it also attracted many little girls to see many cute cats after entering, their coffee is still good",4.0,2019-01-29 12:12:55
55871624,https://ak-d.tripcdn.com/images/Z8070900000040k4gB67D.jpg,xuanxuan wu,"All old cats over 11 years old, cat lovers can give love, almost happy themselves",3.0,2022-11-25 13:55:15
55871624,https://ak-d.tripcdn.com/images/1i54d12000dex2bvn9345.jpg,M32***83,"The ideal cafe for cat lovers, there are many cat comics and cat dolls, and the whole cafe is decorated in a cat-themed style.",5.0,2021-07-24 17:36:17
55871624,https://ak-d.tripcdn.com/images/1i54d12000dex2bvn9345.jpg,M32***83,Cat-themed cafes with plenty of cat comics and cat dolls are a place cat lovers would love to.,5.0,2022-01-02 01:43:29
